monitoring_location,stn_code
"Samarla Kota Canal, Kakinada, East Godavari",2354
"Tulje Bagh Canal, Tekri Drain, Kakinada, East Godavari",2355
"Budameru Canal Nr Bdg At Nh-5, Keesarapally, Krishna",3051
"Guntathippa Drain B/C With Ryves Canal At Ramavarappadu, Krishna",3052
"Tulia Bagh Drain At Vemulavada, East Godavari",3053
"Outlet Of Stp On Godavari, Rajahmundry, East Godavari",3067
Well At Vijaywada,26
"Bore Well. - Krishna Murthy, D.No. 48-16-43 Autonagar Vijjayawada, Krisna Dist",1513
"Bore Well - Vijay Kumar Autonagar Vijayawada, Krishna Dist",1514
Bore Well Of Navlok Gardens Nellore,1516
Bore Well. - Tungbhadra River Near Kurnool,1517
"Bore Well. - Nandyal, Kurnool Dist",1518
"Bore Well - Nagiri, Chittoor Dist",1519
"Bore Well. - Swarnamukhi River, Srikalahasti, Chittoor Dist",1520
"Bore Well. - Near Rama Temple , Ward No.2 , Mindi , Visakhapatnam",1521
Open Well. Peddanuyyi - Vizianagaram,1522
"Bore Well - Near M/S Andhra Sugars Ltd. , Kovvur , W.G.Dist",1523
"Open Well. -Near Partap Nagar Briidge - Kakinada , E.G.Dist",1524
"Bore Well Near Village Secretariat, Pathapadu (V), Krishna",3087
"Hand Pump At Tanam Vill., Vishakhapatnam",3089
"Hand Pump At Pittavanipalem, Vishakhapatnam",3090
"Bore Well At Kapuluppada Dumpsite, Vishakhapatnam",3091
"Bore Well At Arinama Akkivalasa, Srikakulam",3092
"B/W At Alladapalem Village, Pydibhimavaram, Distt Srikakulam",3093
Nagavalli At Thotapalli Regulator,1448
"Vamshadhara, Kalingapatnam, Vizianagaram",2352
"Pulicate Lake , Nellore District",1790
"Kondacharla-Aava Lake, Parawada Pharma City, Vishakhapatnam",2353
Godavari At Polavaram,14
Godavari U/S Rajahmundry,1218
Godavari D/S Rajamundry Of Nalla Channel,2371
Godavari D/S Rajahmundry,1219
Godavari U/S Rajamundry Of Nalla Channel,2370
"Krishna A/C With Tungabhadra, Sangameshwaram",1175
"Vedadri , Guntur Dist",1786
"Amaravati , Guntur Dist",1787
Krishna At Vijaywada,25
"Hamsala Deevi , Guntur Dist",1782
"Krishna D/S Of Srishailam, Kurnool",3083
"Manthralayam , Kurnool Dist",1785
"Tunghabhadra U/S Kurnool, Bavapuram",1174
"Palleru B/C. With Krishna, Jaggayyapet",1178
"Hundri, Joharpur(V), Near Temple, Kurnool",2350
"Pennar B/Cwith Chitravathi, Tadpatri, Unganoor",1255
"Pennar A/C With Papagni, Puspagini",1256
"Pennar A/C With Cheyyuru, Somasile",1257
"Pennar Siddvata, Nellore",30
"Kundu, Nandyal, Near Over Bdg., Kurnool",2351
"Borewell Krishna Murthy, D.No. 48-16-43 Autonagar Vijjayawada",1513
"Borewell Of Navlok Gardens, Nellore",1516
Borewell Near Tungbhadra River Kurnool,1517
Borewell At Nandyal (Kundu),1518
Borewell At Nagiri,1519
Borewell Near Swarnamukhi River At Srikalahasti,1520
Open Well Peddanuvvi - Vizianagaram,1522
Open Well Near Partap Nagar Bridge - Kakinada,1524
"Bore Well At Alladapalem Village, Pydibhimavaram",3093
"Pulicate Lake , Nellore Dist.",1790
"Godavari At Basara, Adilabad",2360
"Godavari At Mancherial, Near Rly Bdg B/C Of Rallavagu",2361
"Godavari At Ramagundam D/S, Near Fci Intake Well, Karimnagar",2362
"Godavari At Godavarikhani, Near Bathing Ghat, Karimnagar",2363
"Godavari At Ramagundam U/S , Karimnagar",2364
"Godavari, D/S Of Ramanugundam",2356
"Godavari At Kamalpur U/S M/S Ap Rayons Ltd. Intake Well, Warangal",2365
"Godavari At Kamalpur D/S At M/S. Ap Rayons Ltd. Discharge Point, Warangal",2366
Godavari At Mancherial,13
"Godavari At Bhadrachalam U/S Bathing Ghat, Khammam",2367
"Godavari At Bhadrachalam D/S Bathing Ghat, Khammam",2368
"Godavari At Burgampahad, Khammam",2369
"Godavari At Rajamundry D/S Of Nalla Channel, East Godavari District",2370
"Godavari At Rajahmundry U/S Kumaradevam, East Godavari",1218
Godavari At Rajamun U/S Of Nalla Channel,2371
"Godavari At Rajahmundry D/S Dhavaleswaram, East Godavari",1219
Manjeera At Gowdicharla B/C With Nakkavagu,2374
Manjeera At Gowdicharla A/C With Nakkavagu,2375
"Manjeera River Near Ganapathi Sugars , Medak Dist.",1781
Manjeera At Raipallu,1157
Manjeera At D/S In Intake Point To Bidar City,1891
Maner At Warangal U/S,1215
Maner At Somnapalli,1158
"Kinnerasani A/C Of Ktps Ash Pond Effluents, Khammam",2372
"Sabari At Kunavaram, Khammam",2373
"Thangadi , Mahaboobnagar Dist.",1784
Krishna At Gadwal Bridge,39
Krishna At Wadapally After Confl. With R. Musi,1465
Krishna At Vedadri,1786
Krishna At Amaravati,1787
Krishna At Hamsaladeevi,1782
"Tungabhadra At Kurnool U/S, Bavapuram",1174
Tungabhadra At Manthralayam,1785
Musi U/S At Hyderabad,1172
Musi D/S At Hyderabad,1173
"River Musi At Nagole, Rangareddy",2339
"Musi Reservoir At Kasaniguda, Nalgonda",3082
"Palleru B/C With Krishna, Jaggayyapet",1178
"Muneru B/C With Krishna, Nandigama",1177
"Nakkavagu, Bachugudem, Medak",2349
"River Hundri At Joharapuram(V), Near Temple, Kurnool",2350
"Pennar B/C With Chitravathi, Tadpatri, Unganoor",1255
"Pennar A/C With Cheyyuru, Somasila",1257
"Pennar At Siddvatam, Nellore",30
"River Kundu, Nandyal, Near Over Bdg., Kurnool",2351
1516,GEN-490640
1517,GEN-81C872
1518,GEN-42D6C7
1519,GEN-5607FE
1522,GEN-3FB451
"Nagavalli At Thotapalli Regulator, A.P.",1448
"River Vamshadhara, Kalingapatnam, Vizianagaram, A.P",2352
Andhra Pradesh,"SAMARLA KOTA CANAL,
KAKINADA, EAST GODAVARI, A.P"
"Godavari At Polavaram, A.P.",14
"Godavari At Rajamundry D/S Of Nalla Channel, A.P",2371
"Well At Gram Panchayat Office, Kaanuru, Vijaywada",26
Borewell Vijay Kumar Autonagar Vijayawada,1514
"Open Well Near Rama Temple , Ward No.2 , Mindi , Visakhapatnam",1521
"Borewell Near M/S Andhra Sugars Ltd. , Kovvur",1523
Open Well Near Partap Nagar Bridge -Kakinada,1524
"Bore Well Near Village Secretariat, Pathapadu (V)",3087
"Borewell At Zp High School, Uddanam Region, Amalapadu (V) Vajrapukotturu",4350
"Bore Well At Mangaraju House, Gajapathinagaram Village, Payakaraopeta (M)",4353
"Bore Well, Sri Nookatata Temple Rajayyapeta Village, Nakkapalli (M)",4354
"Bore Well, Chippada Village, Bheemunipatnam (M)",4355
"Bore Well At Ida, Ramanayyapeta, Kkainada",4360
"Borewell At Rajiv Gruha Ka;Pa, Near Ap Paper Maills Workers Colony, Mallayapeta, Katheru, Rajamahendravaram",4364
"Borewell Water , Apiic Office, Ida Kondapalli, Ibrahimpatnam (M)",4376
"Borewell At Imitation Jewellary Park, Machiliptnam",4377
"Borewell Water , Sri Venkateswara Swamy Temple, Venkatapalem (V), Tullur (M)",4380
"Borewell Water Police Station, Autonagar, Pedakakani, Guntur",4382
"Borewell In Front Of M/S Bhageeradha Chemicals & Industries Ltd,",4384
"Borewell Near Sri Govindaraja Swamy Temple, Tirupati Town",4392
"Closed Msw Dumpsite, Ukkayapalli (V), Kadapa (M)",4393
"Borewell At Apllc Office Industrial Estate Growth Centre, Thumakunta, Hindupur (M)",4394
"Borewell At Apllc Office Industrial Estate, Anantapuram (M)",4395
"Pulicate Lake , Nellore Dist",1790
"Kondakarla-Aava Lake, Parawada Pharma City, Vishakhapatnam",2353
"Kolleru Lake Kokkirayalanka (V), Kailalur (M)",4368
"Chengambakam Tank In Sri City Sez, Tirupathi",4391
Eleru Canal Near Pharma City,4356
"Krishna Canal At Hanuman Nagar, Near Saibaba Temple, Eliru",4370
"Gostta Nadi- Velpuru Canal At Hanuman Temple, Downstream Of Tanuku Town, Attili (M)",4374
"Sea Water , Bay Of Bengal, After Confluence Of Marine Outfall Of M/S. Aurobindo Pharma Ltd. Pydibheemavaram (V) Ranasthalam (M)",4349
"Sea Waer Bay Of Bengal, After Confluence Of Marine Outfall Of M/S Matrix Laboratories Ltd Thammayyapalem (V) Pusapatirega (M)",4352
"Sea Water, Bay Of Bengal After Confluence Of River Vashista Godavari At Chinnamainavanilanka (V), Narsapur (M)",4371
"Sea Water, Bay Of Bengal, Manginapudi Beach, Machilipatnam",4378
"Sea Water Bay Of Bengal, Fishing Harbour, Nizampatnam",4383
"Sea Water, Bay Of Bengal, Kothapatnam Beach",4385
"Sea Water, Bay Of Bengal, Vadarevu Beach, Chirala",4386
"Sea Water, Bay Of Bengal, Krishnapatnam Port",4387
"Sea Water Bay Bengal, Uppada Beach Road, Kakinada",4361
"Sea Water, Bay Of Bengal Near Deep Water Port, Kakinada (1Km Away From Jetty)",4362
"Sea Water Bay Of Bengal Near Kumbhabhishekam Tempale, Kakinada",4363
"Guntathippa Drain B/C With Ryves Canal At Ramavarappadu, Krishna, A.P.",3052
"Tulia Bagh Drain At Vemulavada, East Godavari, A.P.",3053
"Outlet Of Stp On Godavari, Rajahmundry, East Godavari, A.P.",3067
"Gostani River Sample After Confluence With M/S Delta Papeer Mill Effluents, Bendra, Palakoderu (M), But Before Confluence With Yanamadurru Drain",4373
Stp At Rajahmundry,20004
"River Gowthami (Godavari) Govalanka, Injaram (V), Near Gmc Balayogi Bridge, Tallarevu (M)",4358
"Nagavali At Thotapalli Regulator, Vizianagaram",1448
"River Nagavali Near Nh- 16 Bridge, Upstream (U/S) Of Srikakulam Town, Before Confluence Of Town Sewage",4346
"River Nagavali Near Water Pump House (Killipalem) , Down Stream (D/S) Of Srikakulam Town, After Confluence Of Town Sewage",4347
"River Vamsadhara, Immediate Border Between Andhra Pradesh & Orissa States, Near Lalithamba Temple, Battili (V) Bhamini (M)",4348
"River Nagavali Immediate Border Between Andhra Pradesh & Orissa States, Near Sivalayam, Kuneru (V), Komarada (M)",4351
"Papavinasanam Reservoir, Tirumala",4390
Rushikonda Beach,4357
"Upputeru Before Confluence With Sea, At Chinagollapalem Village, Kruthivennu (M)",4379
"Vamsadhara, Kalingapatnam, Vizianagaram",2352
"Colling Water Blowdowns From Andhra Sugars Ltd, Tanuku Before Joining River Godavari",4369
"Godavari At Rajahmundry U/S, Kumaradevam, East Godavari",1218
"Godavari At Rajahmundry D/S, Dhavaleswaram, East Godavari",1219
"Godavari At Rajamundry U/S Of Nalla Channel, East Godavari District",2370
"Godavari At Polavaram, West Godavari District",14
"Krishna A/C With Tungabhadra, Sangameshwaram, Kurnool",1175
"Krishna At Vedadri, Kurnool",1786
"D/S Of River Krishna A/C With Treated Sewage Discharging From 10Mld Stp Located At Ramalingeshwarnagar, Vijayawada, Krishna",3079
"Krishna At Amaravati, Guntur",1787
"Krishna At Vijaywada, Krishna",25
Krishna At Hamsaladeevi Puligadda Aqueduct Near Avanigadda(V),1782
"Tungabhadra At Kurnool U/S, Bhavapuram, Kurnool",1174
"Tungabhadra At Manthralayam, Kurnool",1785
"Palleru B/C With Krishna, Jaggaiapet",1178
"Pennar B/C With Chitravathi, Tadipatri, Unganoor, Anantapura",1255
"Pennar A/C With Papagni, Pushpagini, Kadapa",1256
"Pennar A/C With Cheyyuru, Somasila, Nellore",1257
"Pennar At Siddvatam, Kadapa",30
"Borewell In Front Of M/S Bhageeradha Chemicals & Industries Ltd, Cheruvukommupalem (V) Ongole (M)",4384
"Budameru Canal Nr Bdg At Nh- 5, Keesarapally, Krishna",3051
"River Nagavali At Thotapalli Regulator, Vizianagaram",1448
"River Vamsadhara, Kalingapatnam, Vizianagaram",2352
"River Upputeru Before Confluence With Sea, At Chinagollapalem Village, Kruthivennu (M)",4379
Alaganoor Reservoir,4922
3052,1
3053,2
3067S,3
4369,4
4373,5
20004,1
"Kukunur (M), Border Between A.P. &",4367
Discharging From Stp Located At,3079
Musi At Vadapalli (V) Between A.P. &,4381
"Borewell At Rajiv Gruha Ka;Pa, Near Ap Paper Maills Workers Colony,",4364
Annamayya Project On Cheyyeru Reservoir,4921
Anumanapalle Cheruvu,4936
Bramhasagar,4919
Dali Tank,4926
Gacchakayala Pora (Lagoon),4931
Gangineni Cheruvu,4917
Interu Swamps,4934
Kattamanchi Cheruvu,4918
Krishna Mangroves,4933
Mid Pennar Reservoir,4916
Naupada Swamps,4925
P .S. Chinnaiah Palem,4930
Patatekalli Cheruvu,4924
Pathakotha Cheruvu,4915
Pedda Cheruvu,4928
Sangameswara Backwaters,4923
Somasila Back Water,4920
Tatipudi Reservoir,4927
Uppalanka Mudflats,4929
Uppalapadu Tank,4935
Yerrakaluva Reservoir,4932
"River Godavari At Rajahmundry U/S, Kumaradevam, East Godavari",1218
"River Godavari At Rajahmundry D/S, Dhavaleswaram, East Godavari",1219
"River Godavari At Rajamundry U/S Of Nalla Channel, East Godavari District",2370
"River Godavari At Rajamundry D/S Of Nalla Channel, East Godavari District",2371
"River Godavari After Confluence With Sabari Tributary, (Kunavaram) At Waddigudem(V) V.R. Puram (M)",4359
"River Godavari At Polavaram, West Godavari District",14
"River Sabari At Kunavaram, Khammam",2373
"River Krishna A/C With Tungabhadra,",1175
"River Krishna At Vedadri, Kurnool",1786
"River Krishna D/S Of Srishailam, Kurnool",3083
"River Krishna D/S Of Ramalingeshwarnagar A/C With Treated Sewage Discharging From 10Mld Stp Located At Ramalingeshwarnagar, Vijayawada, Krishna",3079
"River Krishna At Amaravati, Guntur",1787
"River Krishna At Vijaywada, Krishna",25
"River Krishna At Hamsaladeevi Puligadda Aqueduct Near Avanigadda(V), Krishna District",1782
"River Krishna, Pavithra Sangamam, After Confluence With River Godavari Water Lbrahimpatnam (M)",4375
"River Tungabhadra, Upstream Of Kurnool Town Before Joining City Domestic Sewage And After M/S Rayalaseema Alkalies Industries Near Sivalayam Temple, Gondiparla (V) Kurnool (M)",4388
"River Tungabhadra, Downstream Of Kurnool Town After Joining City Domestic Sewage",4389
"River Tungabhadra At Kurnool U/S, Bhavapuram",1174
"River Tungabhadra At Manthralayam, Kurnool",1785
"River Palleru B/C With Krishna, Jaggaiapet",1178
"River Muneru B/C With Krishna, Nandigama",1177
"River Pennar B/C With Chitravathi, Tadipatri, Unganoor, Anantapura",1255
"River Pennar A/C With Papagni, Pushpagini, Kadapa",1256
"River Pennar A/C With Cheyyuru, Somasila, Nellore",1257
"River Pennar At Siddvatam, Kadapa",30
"Bore Well At Kanuru Panchayat, Vijayawada",26
"Bore Well At Autonagar, Vijayawada.( In The R/O Of Mr Satyanarayana Plot No:79 H.No:74-1-7/2C,Auto Nagar Vijayawada)",1513
"Bore Well At Autonagar, Vijayawada. ( In The R/O Of Mr. Vijay Kumar)",1514
"Borewell Of Navlok Gardens, Nellore Town",1516
"Borewell Near Tungbhadra River, Mamidalapadu (V), Kurnool (M)",1517
Borewell At Nandyal Town,1518
Borewell At Nagiri Town,1519
Borewell Near Swarnamukhi River At Srikalahasti Town,1520
"Open Well Near Rama Temple, Ward No.2, Mindi, Visakhapatnam",1521
"Open Well Peddanuvvi, Ponnada (V), Etcherla (M)",1522
"Borewell Near M/S Andhra Sugars Ltd., Kovvur Town",1523
Open Well Near Partap Nagar Bridge - Kakinada Town,1524
"Borewell Near Grampanchayat Office, Pathapadu (V), Vijayawada Rural",3087
"Hand Pump At Tanam (V), Parawada (M)",3089
"Hand Pump At Pittavanipalem (V), Parawada (M)",3090
"Bore Well At Arinam Akkivalasa (V), Etcherla (M)",3092
"Bore Well At Alladapalem (V), Pusapatirega(M)",3093
"Borewell At Zp High School, Uddanam Region, Amalapadu (V), Vajrapukotturu (M)",4350
"Bore Well, Chippada (V), Bheemunipatnam (M)",4355
"Bore Well At Ida, Ramanayyapeta, Kakinada Town",4360
"Bore Wall At Rajiv Gruhakalapa, Near Ap Paper Mills Workers Colony, Mallayyapeta, Katheru, Rajamahendravaram",4364
"Borewell Water , Apiic Office, Ida Kondapalli, Kondapalli (V), Ibrahimpatnam (M)",4376
"Borewell At Imitation Jewellary Park, Machiliptnam Town",4377
"Borewell Water , Sri Venkateswara Swamy Temple, Venkata Palem (V), Tullur (M)",4380
"Borewell At Pedakakani Police Station, Autonagar, Pedakakani (V & M)",4382
"Borewell In Front Of M/S Bhageeradha Chemicals & Industries Ltd, Cheruvukommupalem (V), Ongole (M)",4384
"Borewell At Apiic Office Industrial Estate Growth Centre, Thumakunta (V), Hindupur (M)",4394
"Borewell At Apiic Office Industrial Estate, Anantapur(M)",4395
"Sea Water, Bay Of Bengal, After Confluence Of Marine Outfall Of M/S.Aurobindo Pharma Ltd. Pydibheemavaram (V), Ranasthalam (M)",4349
"Rushikonda Beach,Visakhapatnam",4357
"Sea Water, Bay Of Bengal, Manginapudi Beach, Machilipatnam (V & M)",4378
"Sea Water Bay Of Bengal, Fishing Harbour, Nizampatnam (V & M)",4383
"Sea Water, Bay Of Bengal, Vodarevu Beach, Chirala",4386
"Brahmamsagar, Kandimallayapalli (V)",4919
"Gangineni Cheruvu, Chittoor Town",4917
"River Nagavali At Thotapalli Regulator, Thotapalli (V), Garugubilli (M)",1448
"River Vamsadhara, Gara (V & M)",2352
"Teki Drain At Tallarevu, Tallarevu (V & M), Before Joining Coringa Wildlife Sanctuary",2355
"Guntathippa Drain B/C With Rives Canal At Ramavarappadu, Vijayawada Town",3052
"Tulia Bagh Drain At Matlapalem (V), Vemulavada (M)",3053
"Colling Water Blow Downs From Andhra Sugars Ltd., Kovvur, Before Joining River Godavari",4369
"Samarla Kota Canal,Samarla Kota (V & M)",2354
"Budameru Canal Near Bdg At Nh-5, Keesarapalli (V), Gannavaram (M)",3051
"Eleru Canal, Near Pharma City,Thadi (V),Paravada (M)",4356
"Krishna Canal At Hanuman Nagar, Near Saibaba Temple, Eluru",4370
"Gostta Nadi- Velpuru Canal At Hanuman Temple, Downstream Of Tanuku Town, Tanuku",4374
River Godavari After Confluence With Sabari Tributary (Kunavaram) At Waddigudem(V) V.R. Puram (M),4359
"River Godavari At Rajahmundry U/S, Kumaradevam (V), Kovvur (M)",1218
"River Godavari At Rajahmundry D/S, Dowleswaram (V), Rajahmundry (M)",1219
"River Godavari At Rajamundry U/S Of Nalla Channel,Rajamundry",2370
"River Godavari At Rajamundry D/S Of Nalla Channel, Rajamundry",2371
River Godavari At Polavaram (V & M),14
"River Godavari D/S Dowleiswaram After Confluence Of Stp Outlet, Dowleiswaram (V)",3067
"River Sabari At Kunavaram, East Godavari Dist",2373
"River Gostani Sample Before Confluence With M/S Delta Paper Mill Effluents, Vendra (V), Palakoderu (M)",4372
"River Gostani Sample After Confluence With M/S Delta Papeer Mill Effluents, Bendra, Palakoderu (M), But Before Confluence With Yanamadurru Drain",4373
"River Krishna A/C With Tungabhadra, Sangameshwaram (V), Kottapalle (M)",1175
"River Krishna At Vedadri (V), Jaggayyapeta (M)",1786
"River Krishna D/S Of Srishailam, Srishailam",3083
"River Krishna At Amaravati, Amaravati (V & M)",1787
River Krishna At Vijaywada Town,25
River Krishna At Hamsaladeevi Puligadda Aqueduct Near Avanigadda (V),1782
"River Krishna, Pavithra Sangamam, After Confluence With River Godavari Water, Ferry (V), Ibrahimpatnam (M)",4375
"River Tungabhadra At Kurnool U/S, Bhavapuram (V), Kurnool (M)",1174
River Tungabhadra At Manthralayam (V & M),1785
"River Tungabhadra, Upstream Of Kurnool Town Before Joining City Domestic Sewage And After M/S Rayalaseema Alkalies Industries Near Sivalayam Temple, Gondiparla (V), Kurnool (M)",4388
"River Tungabhadra, Downstream Of Kurnool Town After Joining City Domestic Sewage, Padidempadu (V),",4389
"River Palleru B/C With Krishna, Jaggaiapet (V &M)",1178
"River Muneru B/C With Krishna, Keesara (V & M)",1177
"River Hundri At Laxmipuram (V), Kallur",2350
"River Upputeru Before Confluence With Sea, At Chinna Gollapalem (V), Kruthivennu (M)",4379
"River Pennar B/C With Chitravathi, Tadipatri (M), Venganur (V)",1255
"River Pennar A/C With Papagni, Pushpagiri (V),Vallur (M)",1256
"River Pennar A/C With Cheyyuru, Somasila (V), Ananthasagaram (M)",1257
River Pennar At Siddavatam (V & M),30
"River Kundu, Nandyal, Near Over Bdg.,Nandyal Town",2351
