monitoring_location,stn_code
"Digboi, Tinsukia Distt",1533
Karbi Anglong Distt,1534
Sibsagar,1535
(Jorhat,1537
Silchar,1538
Barpeta,1539
Bonaigaon,1540
Guwahati,1541
"Ground Water From Ledo, Margherita",2243
Ground Water From Nazira,2244
Ground Water From Numaligarh (Near Nrl Te Labor Colony),2245
Ground Water From Semenchapari,2246
Ground Water From Silapathar,2247
Ground Water From Lakhimpur Town,2248
Ground Water From Tezpur (Mission Chariali),2249
Ground Water From Nagaon (Panigaon),2250
Ground Water From Jagiroad Near Hpc Effluent Discharge Point,2251
Ground Water Near Msw Dumping Site At Garchuk-Guwahati,2252
Ground Water From Nalbari,2253
Ground Water From Barpeta Road(Rly Station),2254
"Ground Water Near Bprl, Dhaligaon",2255
Ground Water From Kokrajhar District (Hs School ),2256
Ground Water From Dhubri District (College Nagar ),2257
Ground Water From Hamren,2260
Ground Water From Haflong,2261
Ground Water From Karimganj (College),2262
Ground Water From Hialakandi (Near,2263
Ground Water In Panchgram Market Near Cachar Paper Mill,2264
Mer Beel At Madhabpur,2205
Daloni Beel Near Jogighopa,2206
Elangabeel System Pond (Connected To R. Kolang),1263
Bor Beel At Jakai,2207
"Borpukhuri, Nazira",2208
"Gaurisagar Tank, Gaurisagar",2209
"Rajmaw Pukhuri, Jorhat",2210
"Padumpukhuri, Tezpur",2211
"Gophur Tank, Gophur",2212
"Jaipal Pukhuri, Sipajhar",2213
"Botodriva Satra Pond, Nagaon",2214
Saran Beel,2215
"Dighali Pukhuri, Guwahati",2216
"Subhagya Kunda Pond Kamakhya Temple, Guwahati",2217
"Deepar Beel At Boragaon Near Iasst, Guwahati",2218
"Bishnu Puskar Pukhuri Of Hayagrib Madhab Temple, Hajo",2219
"Chand Dubi Beel, Chand Dubi",2220
"Ganga Pukhuri, Nalbari (Gordon School)",2221
Rajadinia Pukhuri At Abhayapuri,2222
Mahamaya Mandir Pukhuri,2223
Rajapukhuri At Gauripur,2224
"Baskandi Pond Inside The Baskandi Madrasa, Baskandi",2225
Sivasagar Tank (Borpukhuri) Near Sivadol,2226
"Hordai Pukhuri, Charaidew",2227
Gala Beel At Dergaon,2228
"Goysagar Tank, Sibsagar",1532
Brahamputra At Kherghat (A/C With Dibang & Dihang),1260
Brahamputra At Dibrugarh,1030
Brahamputra At Nimatighat,1262
Brahmputra At Dhenukhapahar,1526
Brahamputra At Pandu,1031
Brahmaputra At Dhubri,2066
Brahamputra At Jogijhoga Near Bridge,1299
"Brahmputra Near Water Intake Point At Kacharighat, Panbazar, Guwahati",2069
"Brahmaputra River At Chandrapur, Guwahati",2064
"Brahmputra River At Sualkuchi, Dist. Kamrup",2067
"Kathakal, U/S At Matijuri, Dist. Hailakandi",2068
Dhansiri At Golaghat,1259
"Dhansiri At Nagaland- Assam Border, Dimapur",1928
Barak D/S Of Silchar,2240
Beki At Nh-37 Crossing At Barpeta Road,2238
Bharalu At Guwahati,1528
Bhogdoi At Jorhat,1527
"Boginadi Near Bridge Nh-52, Lakhimpur",2233
Borak At Panchagram,1423
Burhidihing At Margherita,1422
Burhidihing At Duliajan (Intake Point Of Oil India Ltd.),2230
Buridihing D/S Near Duliajan Tinsukia,2062
Deepar Beel,1529
"Digboi At Lakhipathe, Reserve Forest, Digboi",1530
Dikhow At Dikhow Bridge Sivasagar,2231
Disang At Gundamghat,1298
"Disang At Dillighat, Dibrugarh Dist",2058
"Jai Bharali Near Biswanath Charali, Sonitpur",2063
Jhanji At N.H. Crossing Jorhat,1258
"Kalong At U/S Of Anandaram Dekial Phukan Bridge, Nagaon",2237
"Kapili At Dharmtul Bridge, Nh- 31, Nagaon",2236
Kharsang B/C With Buridihing Near Kharsang (Assam- Arunanchal Border),2061
"Kohora At N.H. Crossing, Kohora",2232
Kolong At Marigaon,2059
"Kundli At Kundli/ Sapakhowa, Sadia",2229
Kushiara At Karimganj,2242
"Manas At Nh-31 Crossing, Barpeta, District",2060
Mora Bharali At Tezpur,1531
"Pagldia Near Nalbari Town, Dist. Nalbari",2065
"Panchnai At Nh-52 Crossing, Orang",2235
Ranga Nadi D/S Of Hydel Project,2234
Sankosh Dhubri,2239
Sonai River At Sonai,2241
"Subansiri At Gerekamukh, B/C With Brahmaputra",1261
"Digboi, Tinsukia Distt., Assam",1533
"Ground Water At Karbi Anglong Distt., Assam",1534
Ground Water Near Bpms H.S. School Sonari Town Dist Charaideo,1536
"Ground Water At (Jorhat, Assam)",1537
"Ground Water At Silchar, Assam",1538
"Ground Water At Barpeta, Assam",1539
"Ground Water At Bonaigaon, Assam",1540
"Ground Water At Sijubari Mazar, Natboma Hatigaon",1542
"Ground Water From Nazira, Assam",2244
"Ground Water From Semenchapari, Assam",2246
"Ground Water From Silapathar, Assam",2247
"Ground Water From Lakhimpur Town, Assam",2248
"Ground Water From Nagaon (Panigaon), Assam",2250
"Ground Water Near Msw Dumping Site At Garchuk-Guwahati, Assam",2252
"Ground Water From Nalbari, Assam",2253
"Ground Water From Barpeta Road(Rly Station), Assam",2254
"Ground Water Near Bprl, Dhaligaon, Assam",2255
"Ground Water From Kokrajhar District (Hs School ), Assam",2256
"Ground Water From Hamren, Assam",2260
"Ground Water From Haflong, Assam",2261
"Ground Water From Karimganj (College), Assam",2262
"Ground Water In Panchgram Market Near Cachar Paper Mill, Assam",2264
Biswanath Chariali Town,3761
"Municipal Waste Processing Facility, Morabharli, Tezpur",3762
Mangaldoi Town,3766
"Ground Water Near Garmur Recreation Ground, Jorhat",3770
"Ground Water From Garmur, Majuli",3779
"Tube Well At R/O Sri Tankeswar Das, Rupjyoti Colony (Nagabali) Municipality Dumping Site, Golaghat",3793
"Tube Well Of Wokha Goronga Girls Me School, Gorounga Tiniali, Furkating",3795
"Ground Water From Mehepur Near A Cluster Of Nursing Home & Diagnostic Centre, Meherpur, Cachar",3802
"Ground Water From Bonda, Guwahati",3813
"Ground Water From Khanapara, Guwahati",3815
"Ground Water From Basistha, Guwahati",3816
"Ground Water From Kahilipara, Guwahati",3817
"Ground Water From Maligaon, Guwahati",3818
"Near Panthanivas, Sambalpur",3970
"Daloni Beel Near Jogighopa, Assam",2206
"Bor Beel At Jakai., Assam",2207
"Borpukhuri, Nazira, Assam",2208
"Gaurisagar Tank, Gaurisagar, Assam",2209
"Padumpukhuri, Tezpur, Assam",2211
"Jaipal Pukhuri, Sipajhar, Assam",2213
"Saran Beel, Assam",2215
"Subhagya Kunda Pond Kamakhya Temple, Guwahati, Assam",2217
"Bishnu Puskar Pukhuri Of Hayagrib Madhab Temple, Hajo, Assam",2219
"Ganga Pukhuri, Nalbari (Gordon School), Assam",2221
"Mahamaya Mandir Pukhuri, Assam",2223
"Baskandi Pond Inside The Baskandi Madrasa, Baskandi, Assam",2225
"Hordai Pukhuri, Charaidew, Assam",2227
Borpukhuri At Sonari,3772
Pond Water From Ramkrishna Mission At Hailakandi,3806
"Brahamputra At Kherghat (After Confl. With Dibang & Dihang), Assam",1260
"Brahamputra At Dibrugarh, Assam",1030
"Brahamputra At Nimatighat, Assam",1262
"Brahmputra River At Dhenukhapahar, Assam",1526
"Brahamputra At Pandu, Assam",1031
"Brahamputra At Jogijhoga Near Bridge, Assam",1299
"Brahmputra River Near Water Intake Point At Kacharighat, Panbazar, Guwahati, Assam",2069
"Brahmaputra River At Chandrapur, Guwahati, Assam",2064
"Brahmputra River At Sualkuchi, Dist. Kamrup, Assam",2067
"Brahmaputra River At Dhubri, Assam",2066
"Brahamputra River At Bogibeel Bridge, Bogibeel, Dibrugarh",3781
"Dhansiri At Golaghat, Assam",1259
"Dhansiri At Nagalandassam Border, Dimapur",1928
"Subansiri At Gerekamukh (Before Confl. With Brah.), Assam",1261
"Kharsang Before Confluence With Buridihing Near Kharsang (Assamarunanchal Border), Assam",2061
"Burhidihing At Margherita, Assam",1422
"Burhidihing Near Duliajan At D/S, Tinsukia, Assam",2062
"Burhidihing River At Duliajan (Intake Point Of Oil India Ltd.), Assam",2230
"Pagldia River Near Nalbari Town, Dist. Nalbari, Assam",2065
"Digboi River At Lakhipathe, Reserve Forest, Digboi, Assam",1530
"Jai Bharali River Near Biswanath Charali, Sonitpur, Assam",2063
"Kolong River At U/S Of Anandaram Dekial Phukan Bridge, Nagaon, Assam",2237
"Kolong River At Marigaon, Assam",2059
"Manas River At Nh31 Crossing, Barpeta, District, Assam",2060
"Disang River At Dillighat, Dibrugarh Dist., Assam",2058
"Disang At Gundamghat, Assam",1298
"Jhanji At N.H. Crossing Jorhat, Assam",1258
"Bhogdoi River At Jorhat , Assam",1527
"Mora Bharali At Tezpur, Assam",1531
"Barak At Panchagram , Assam",1423
"Barak River Near Noney Village (N.H. 53), Tamenglong",2838
Barak River At Senapati,2869
"Barak River At N.H. 53, Tamenglong .",2875
"Bharalu River At Guwahati, Assam",1528
"Deepar Bill, Assam*",1529
"Kathakal U/S At Matijuri, Dist. Hailakandi, Assam",2068
"Ganga River At Chandrapur, Itanagar,",3095
"Dikrong River At Nirjuli,",3096
"Lohit River At Alubari,",3099
"Namchik River At Kharsang,",3100
"Pachin River At Naharlagun (Below Barapani Bridge),",3103
"Gai Nadi Near Hss Likabali,",3105
"Dibang River At Roing,",3106
"Dihing River At Miao,",3107
"Bhogdoi River (Pujadubi Ghat) Intake Point Of Urban Water Supply, Jorhat",3769
"Dikhow River At Nagini Mora (Interstate Boundaries, Assamnagaland)",3776
Teesta At Siliguri,1947
"Dikhow River At Dikhow Bridge Sivasagar, Assam",2231
"Kohora River At N.H. Crossing, Kohora, Assam",2232
"Boginadi Near Bridge Nh52, Lakhimpur, Assam",2233
"Ranga Nadi D/S Of Hydel Project, Assam",2234
"Kapili River At Dharmtul Bridge, Nh31, Nagaon, Assam",2236
"Beki River At Nh37 Crossing At Barpeta Road, Assam",2238
"Sankosh River, Dhubri, Assam",2239
"Barak River At D/S Of Silchar, Assam",2240
"Sonai River At Sonai, Assam",2241
"Kushiara River At Karimganj, Assam",2242
"Panchnai River At Nh52 Crossing, Orang, Assam",2235
1534,GEN-D63FBF
1537,GEN-D1A696
1538,GEN-B60C5A
1539,GEN-17E23E
1540,GEN-CDA721
1541,GEN-1373B2
1542,GEN-D01039
2244,GEN-3147DA
2246,GEN-758A06
2247,GEN-DF1F1D
2253,GEN-CE6C92
2260,GEN-4CB811
2261,GEN-BBAA9D
3761,GEN-092CB1
3766,GEN-79CAE1
3779,GEN-8CE87B
3813,GEN-0A49E3
3816,GEN-C91124
3817,GEN-FA6C94
3818,GEN-B99469
4001,GEN-FFC581
4002,GEN-254ED7
4007,GEN-AB8DF9
4008,GEN-21B568
4303,GEN-B052E2
3970,GEN-11BCD3
2207,GEN-4AECFB
2208,GEN-CD3AFE
2215,GEN-02E656
3772,GEN-83DDFB
"Digboi River At Lakhipathe, Reserve Forest, Digboi",1530
"Intake Point Of Urban Water Supply, Bhogdoi River",3769
Dikhow River At Nagini Mora (Inter-State Boundarie,3776
"Beki River At Nh-37 Crossing At Barpeta Road, Assa",2238
"Ground Water At Digboi, Tinsukia Distt., Assam",1533
"Ground Water At Sibsagar Govt Me School Ward 6, Red Cross Road , Assam",1535
"Ground Water At Noonmati Guwahati, Assam",1541
"Ground Water From Ledo, Margherita, Assam",2243
"Ground Water From Numaligarh (Near Nrl Te Labor Colony), Assam",2245
"Ground Water From Tezpur (Mission Chariali), Assam",2249
"Ground Water From Jagiroad Near Hpc Effluent Discharge Point, Assam",2251
"Ground Water Near Msw Dumping Site At Garchuk- Guwahati, Assam",2252
"Ground Water From Dhubri District (College Nagar ), Assam",2257
"Ground Water From Diphu (Govt. College), Assam",2259
"Ground Water From Hialakandi (Near Astc Bus Stand ), Assam",2263
Ground Water From Biswanath Chariali Town,3761
"Ground Water Near Municipal Waste Processing Facility, Morabharli, Tezpur",3762
Ground Water From Mangaldoi Town,3766
"Ground Water From Titabar Urban Water Supply, Titabar",3771
"Ground Water Near Gogamukh Public Water Supply Scheme, Gogamukh, Dhemaji",3790
"Tube Well At R/O Sri Anil Baora At Bosagaon Near By The Athkhalia, Namghar, Po: Pulikaitoni",3794
"Ground Water From Mehepur Trenching Ground, Meherpur, Cachar",3801
"Ground Water Near Badarpur Industrial Area At Badarpur Ghat, Karimganj",3805
Ground Water From Panjabari,4001
Ground Water From Santipur,4002
Ground Water From Tezpur Collegiate High School,4003
Ground Water From Lakwah,4007
Ground Water From Satgaon,4303
"Ground Water From Railway Station Road, Rowta",4327
"Ground Water Beside Msw Dumping Site, Dhekiajuli",4328
Ground Water Near Pangram Stone Crasher Cluster,4330
Ground Water From Demow Water Supply Demow Town,4333
"Ground Water From Amguri, Amguri Town",4335
Ground Water Form Tenga Pukhuri Kukurachowa Water Supply Tenga Pukhuri,4338
"Ground Water Near Nagaon Town Pipe Water Supply Scheme(Z-111), Nagaon",4339
"Ground Water From Nagaon College, Nagaon",4340
"Deepar Beel, Assam",1529
"Mer Beel At Madhabpur, Assam",2205
"Deepar Beel At Boragaon Near Iasst, Guwahati, Assam",2218
Son Beel Water At Karimganj,3804
"Kamalabari Lake Inside Kamalabari Children,S Park, Geleky",4337
"Elangabeel System Pond (Connected To R. Kolang), Assam",1263
"Rajmaw Pukhuri, Jorhat, Assam",2210
"Gophur Tank, Gophur, Assam",2212
"Botodriva Satra Pond, Nagaon, Assam",2214
"Dighali Pukhuri, Guwahati, Assam",2216
"Chand Dubi Beel, Chand Dubi, Assam",2220
"Rajadinia Pukhuri At Abhayapuri, Assam",2222
"Rajapukhuri At Gauripur, Assam",2224
"Sivasagar Tank (Borpukhuri) Near Sivadol, Assam",2226
"Gala Beel At Dergaon, Assam",2228
Jorpukhuri At Uzanbazar (Ugratala Temple),3809
Netai Pukhuri At Netai Pukhuri,4006
"Thowradole Pukhuri, Thowradole G.P. Demow Block",4334
"Goysagar Tank, Sibsagar, Assam",1532
"Baroi River, Near Bridge At Nh-52, Biswanath District",3760
"Bega River, Mg Road, Mangaldoi",3765
"Borbeel No. 1 , Ram Nagar, Digboi, Public Water Supply, Tinsukia",3785
"Bordoibam Beelmukh Bird Sanctuary, Dhemaji",3789
"Borsola Beel, Sarabbhatti, Guwahati",3820
Digaru River At Nh Crossing,3807
"Diplai Beel At Silgara, Kokrajhar",3821
"Dorika River Near Msw Dumping Site, Sivasagar",3777
"Gabharu River Near Bridge At Nh- 52, Near Tumiuki, Sonitpur",3763
"Holudunga Beel Near Gai Nadi/ River At Somarajan, Dhema Ji",3787
"Jiadhal River/ Kumotiya River Near Jiadhal Bridge, Dhemaji",3788
Kakodonga River At Nh-37 Crossing,3768
"Kaliani River Near Kanaighat Bridge, Kanaighat",3791
"Kamalpur Beel, Kamalpur",3812
Killing River In Morigaon District,3799
Kuji River (Near New Bogagigaon) Near Water Intake Point For Nf Railway,3796
Kulsi River At Chaygaon Near Nh37 Crossing,3810
"Madhura River At Madhuraghat, Cachar",3803
"Maguri Beel, Guijan, Tinsukia",3783
Malini Beel Near Indutrial Area At Ramnagar,3800
"Niz Kodomoni Pwss Complex, Dibrugarh",3782
"Nuwa Noi River, Near Bridge Over Boinaoja Para, Mangaldoi",3767
Parashali Beel At Demoria,3808
Puthimari River Near Puthimari Chowk At Nh Crossing,3811
Samaguri Beel In Nagaon District,3798
"Sessa River Near Sessa Tiniali, Nh Bridge, Dibrugarh",3780
"Silsako Beel, Chachal, Guwahati",3814
"Soru Sola Beel, Paltan Bazar, Guwahati",3819
Suffry River At Maibella,3774
Tenga Pukhuri At Tengapukhuri,3775
"Tingrai River Near Tinsukia Msw Dumping Site, Itakhola",3784
Towkak River At Sonari,3773
"Brahamputra At Pandu,",1031
"Brahmputra River At Sualkuchi, Dist. Kamrup,",2067
Brahmaputra River At Dhubri,2066
Brahamputra River At Biswanath Ghat,4004
"Dhansiri River Near Bridge At Nh-15, Dhansiri Bhalukmari Jungle, Udalguri",3764
Dhansiri River At Jahaighat,3792
"Dikrong River Near Bridge At Nh-52,",3759
"Gai Nadi/ River At Somarajan, Dhemaji",3786
"Dikhow River At Nagini Mora (Inter-State Boundaries, Assam- Nagaland)",3776
Dikhow River At Dikhomukh Confluence With Brahamputra,3778
"Disang At Gundamghat,",1298
"Disang River At Dillighat, Dibrugarh",2058
Disang River At Nh Crossing,4005
"Gabharu River Near Bridge At Nh-52, Near Tumiuki, Sonitpur",3763
Longalai River Near Calcom Cement Plant,4010
Tocklai River Near Bridge At Jorhat,4011
Tunia River At D/S Brpl,4012
Larsing River Near Locl Depo At Moinarbond,4329
Downstream Of Dhateshwari River At Hailakandi,4331
Demow River Demow Town,4332
"Borsila River At Borsila, Deopani, Namti",4336
"Barnadi River Near Bridge, Nh-52, Dumunichowki Kamrup",4341
"Baralia River (Near Chatpuja Ghat) Rangia, Kamrup (R )",4342
Buradia River (Near Bridge Along Nh-31) Nalbari,4343
"Tihu River (Near Bridge Along Nh-31) Tihu, Nalbari",4344
"Singra River (Near Bridge Along Nh-37) Boko, Kamrup (R )",4345
Ground Water From Geleky,4008
"Tubewell At Assam Oil Petrol Pump, Near Rohtak Road Bypass, Panipat",4856
"River Baroi Near Bridge At Nh-52, Biswanath District",3760
"River Gabharu Near Bridge At Nh-52, Near Tumiuki, Sonitpur",3763
"River Bega Mg Road, Mangaldoi",3765
"River Nuwa Noi Near Bridge Over Boinaoja Para, Mangaldoi",3767
River Kakodonga At Nh-37 Crossing,3768
River Towkak At Sonari,3773
River Suffry At Maibella,3774
River Tenga Pukhuri At Tengapukhuri,3775
"River Dorika Near Msw Dumping Site, Sivasagar",3777
"River Sessa Near Sessa Tiniali, Nh Bridge, Dibrugarh",3780
"River Niz Kodomoni Pwss Complex, Dibrugarh",3782
"River Maguri Beel, Guijan, Tinsukia",3783
"River Tingrai Near Tinsukia Msw Dumping Site, Itakhola",3784
"River Gai Nadi At Somarajan, Dhemaji",3786
"River Jiadhal Kumotiya River Near Jiadhal Bridge, Dhemaji",3788
"River Kaliani Near Kanaighat Bridge, Kanaighat",3791
River Kuji (Near New Bogagigaon) Near Water Intake Point For Nf Railway,3796
River Killing In Morigaon District,3799
"River Madhura At Madhuraghat, Cachar",3803
River Digaru At Nh Crossing,3807
River Kulsi At Chaygaon Near Nh37 Crossing,3810
River Puthimari Near Puthimari Chowk At Nh Crossing,3811
"Brahmputra River At Dhenukhapahar,",1526
"Brahamputra At Jogijhoga Near Bridge,",1299
Assam,2069
"Burhidihing Near Duliajan At D/S, Tinsukia,",2062
"Dikhow River At Dikhow Bridge Sivasagar,",2231
"Disang River At Dillighat, Dibrugarh Dist.,",2058
River Brahamputra At Dibrugarh,1030
River Brahamputra At Nimatighat,1262
River Brahmputra River At Dhenukhapahar,1526
River Brahamputra At Pandu,1031
River Brahamputra At Jogijhoga Near Bridge,1299
"River Brahmputra Near Water Intake Point At Kacharighat, Panbazar, Guwahati",2069
"River Brahmaputra At Chandrapur, Guwahati, Assam",2064
"River Brahmputra At Sualkuchi, Dist. Kamrup",2067
"River Brahmaputra At Dhubri, Assam",2066
"River Brahamputra At Bogibeel Bridge, Bogibeel, Dibrugarh",3781
River Brahamputra At Biswanath Ghat,4004
"River Burhidihing At Margherita, Assam",1422
"River Burhidihing Near Duliajan At D/S, Tinsukia, Assam",2062
"River Burhidihing At Duliajan (Intake Point Of Oil India Ltd.), Assam",2230
"River Dhansiri At Nagaland-Assam Border, Dimapur",1928
"River Dhansiri At Golaghat, Assam",1259
"River Dhansiri Near Bridge At Nh-15, Dhansiri Bhalukmari Jungle, Udalguri",3764
River Dhansiri At Jahaighat,3792
River Dhansiri At Bokajan,30073
River Dhansiri At Numaligarh,30074
"River Bharalu At Guwahati, Assam",1528
"River Dikrong Near Bridge At Nh-52, Bandardewa",3759
"River Digboi At Lakhipathe, Reserve Forest, Digboi, Assam",1530
"River Dikhow At Dikhow Bridge Sivasagar, Assam",2231
"River Dikhow At Nagini Mora (Inter-State Boundaries, Assam- Nagaland)",3776
River Dikhow At Dikhomukh Confluence With Brahamputra,3778
River Disang At Gundamghat,1298
"River Disang At Dillighat, Dibrugarh Dist., Assam",2058
River Disang At Nh Crossing,4005
River Tocklai Near Bridge At Jorhat,4011
River Tunia At D/S Brpl,4012
River Larsing Near Locl Depo At Moinarbond,4329
River Dhateshwari D/S Of Hailakandi,4331
River Demow At Demow Town,4332
"River Borsila At Borsila, Deopani, Namti",4336
"River Barnadi Near Bridge, Nh-52,",4341
"River Subansiri At Gerekamukh (Before Confl. With Brah.), Assam",1261
"River Baralia (Near Chatpuja Ghat) Rangia, Kamrup (R )",4342
River Buradia (Near Bridge Along Nh-31) Nalbari,4343
"River Tihu (Near Bridge Along Nh-31) Tihu, Nalbari",4344
"River Singra (Near Bridge Along Nh-37) Boko, Kamrup (R )",4345
"River Beki At Nh-37 Crossing At Barpeta Road, Assam",2238
"River Bhogdoi At Jorhat , Assam",1527
"River Bhogdoi (Pujadubi Ghat) Intake Point Of Urban Water Supply, Jorhat",3769
"River Jhanji At N.H. Crossing Jorhat, Assam",1258
"River Jai Bharali Near Biswanath Charali, Sonitpur, Assam",2063
"River Sankosh Dhubri, Assam",2239
"River Boginadi Near Bridge Nh-52, Lakhimpur, Assam",2233
"River Sonai At Sonai, Assam",2241
"River Ranga Nadi D/S Of Hydel Project, Assam",2234
"River Kapili At Dharmtul Bridge, Nh-31, Nagaon, Assam",2236
"River Kathakal U/S At Matijuri, Dist. Hailakandi, Assam",2068
"River Kharsang B/C With Buridihing Near Kharsang (Assam- Arunanchal Border), Assam",2061
"River Kohora At N.H. Crossing, Kohora, Assam (Brahmaputra)",2232
"River Kolong At Marigaon, Assam",2059
"River Kolong At U/S Of Anandaram Dekial Phukan Bridge, Nagaon, Assam",2237
"River Kundli At Kundli/ Sapakhowa, Sadia, Assam",2229
"River Kushiara At Karimganj, Assam",2242
River Manas (Santoshpur) Near Lengtisinga,3797
"Manas River At Nh-31 Crossing, Barpeta, District, Assam",2060
"River Pagldia Near Nalbari Town, Dist. Nalbari, Assam",2065
"River Panchnai At Nh-52 Crossing, Orang, Assam",2235
"River Mora Bharali At Tezpur, Assam",1531
"Ground Water At Karbi Anglong Town, Assam",1534
"Ground Water At Sivasagar Govt Me School Ward 6, Red Cross Road , Assam",1535
Ground Water From Near Bpms H.S. School Sonari Town Dist Charaideo,1536
"Ground Water From Jorhat Town, Assam",1537
"Ground Water From Silchar Town , Assam",1538
"Ground Water From Barpeta Town, Assam",1539
"Ground Water From Bonaigaon Town, Assam",1540
"Ground Water From Noonmati Guwahati, Assam",1541
"Ground Water From Sijubari Mazar, Natboma Hatigaon, Guwahati",1542
"Ground Water From Goalpara Dist. (Goalpara College ), Assam",2258
"Ground Water From Niz Kodomoni Pwss Complex, Dibrugarh",3782
"Ground Water From Borbeel No. 1 , Ram Nagar, Digboi, Public Water Supply, Tinsukia",3785
Ground Water From Dhekiajuli Town Nijarapar)P.O.Dhekiajuli,5143
"River Brahmaputra At Dibrugarh, Assam",1030
"River Brahmaputra At Nimatighat, Assam",1262
"River Brahmputra River At Dhenukhapahar, Assam",1526
"River Brahmaputra At Pandu, Assam",1031
"River Brahmaputra At Jogighopa Near Bridge, Assam",1299
"River Brahmputra Near Water Intake Point At Kacharighat, Panbazar, Guwahati, Assam",2069
"River Brahmputra At Sualkuchi, Dist. Kamrup, Assam",2067
River Dhansiri Near Nagaland- Assam Border,1928
"River Dhansiri Near Bridge At Nh- 15, Dhansiri Bhalukmari Jungle, Udalguri",3764
"River Dikrong Near Bridge At Nh- 52, Bandardewa",3759
River Dikhow At Dikhowmukh Confluence With Brahamputra,3778
"River Disang At Gudamghat, Assam",1298
"River Gabharu Near Bridge At Nh- 52, Near Tumiuki, Sonitpur",3763
"River Barnadi Near Bridge, Nh-52, Dumunichowki Kamrup",4341
River Subansiri At Gerukamukh (Before Confluence With River Brahmaputra),1261
"River Baralia (Near Chatpuja Ghat) Rangia, Kamrup",4342
River Buralia (Near Bridge Along Nh-31) Nalbari,4343
"River Tihu (Near Bridge Along Nh- 31) Tihu, Nalbari",4344
"River Singra (Near Bridge Along Nh- 37) Boko, Kamrup",4345
"River Jia Bharali At Biswanath Charali, Sonitpur",2063
"River Kapili At Dharmtul Bridge, Nh-31, Morigaon",2236
"River Kolong At U/S Of Anandaram Dekial Phukan Bridge, Nagaon",2237
"River Manas At Nh- 31 Crossing, Barpeta District, Assam",2060
"River Panchnoi At Nh-52 Crossing, Orang, Assam",2235
River Barak River At Panchagram,1423
"Gela Beel At Dergaon, Assam",2228
River Barak At D/S Of Silchar,2240
"River Aie Near Rakhaldubi Dist., Bongaigaon, Assam",5135
"River, Tunia U/S Brpl, Dhaligaon, Dist. Chirang",5138
"River Jamuna At Doboka Near Bridge, Dist. Hojai",5139
"River Bondanjan, Sluice Gate, Birkuchi Narengi Tiniali, Kharghuli, No. 2",5140
"River Basistha Basistha Chariali, Nutan Bazaar,",5141
"River Pamohi Gachuk, Pamohi Road, Guwahati",5142
River Kalanadi Near Bamunjuli Bridge Crossing At Mangaldoi Bhutiachang,5144
