stn_code,monitoring_location,water_body_type,state,year,temperature_avg,do_avg,ph_avg,conductivity_avg,bod_avg,nitrate_avg,fecal_coliform_avg,total_coliform_avg,fecal_streptococci_avg,total_dissolved_solids_avg,fluoride_avg,arsenic_avg
1555,"TUBEWELL NEAR JSV PUMP STATION RESIDENTIAL AREA KHERI, KALA AMB,",Groundwater,HIMACHAL PRADESH,2022,,,7.19,1034.0,1.1,2.075,,,,442.5,0.635,
1556,BOREWELL NEAR JSV TANK HEERPUR AT PAONTA SAHIB,Groundwater,HIMACHAL PRADESH,2022,23.0,,7.855,643.0,,2.66,,5.65,,319.0,0.78,
1557,BOREWELL AT GABRIEL INDIA LTD. INDUSTRIAL AREA PARWANOO,Groundwater,HIMACHAL PRADESH,2022,,,7.765,645.0,,9.835,14.0,70.0,,346.5,0.48,
1558,GROUND WATER NEAR VMT SPINNING AT BADDI,Groundwater,HIMACHAL PRADESH,2022,,,7.73,1807.0,,2.52,,,,1446.0,0.23,
1559,GROUND WATER NEAR HIGH VALLEY RESIDENTIAL COLONY BAROTIWALA AT BAROTIWALA,Groundwater,HIMACHAL PRADESH,2022,,,7.665,1223.5,2.0,8.52,4.0,38.0,,641.3,0.5,
1560,GROUND WATER NEAR DURGA TEMPLE RAJPURA ROAD NALAGARH AT NALAGARH,Groundwater,HIMACHAL PRADESH,2022,,,7.54,1038.5,,8.66,2.0,25.0,,584.5,0.92,
1561,GROUND WATER NEAR RAM GOPAL TEMPLE AT DAMTAL,Groundwater,HIMACHAL PRADESH,2022,26.0,,6.88,753.0,,0.32,2.0,24.0,,480.0,,
1562,BOREWELL NEAR ISBT UNA,Groundwater,HIMACHAL PRADESH,2022,27.25,,7.395,553.5,,1.725,2.0,24.0,,360.0,,
1873,GROUND WATER U/S OF MSW DUMPING SITE AT DHARAMSHALA KANGRA,Groundwater,HIMACHAL PRADESH,2022,12.0,,6.88,320.0,,0.47,2.0,17.0,,222.0,,
1874,"SPRING SOURCE (GROUND WATER) BELOW SWM SITE AT SALOGRA, VILL. SALOGRA, DISTT. SOLAN",Groundwater,HIMACHAL PRADESH,2022,15.5,,8.03,411.5,,5.205,12.0,52.0,,222.5,0.375,
1876,BOREWELL AT HPMC PARWANOO,Groundwater,HIMACHAL PRADESH,2022,,,8.05,473.0,,9.925,2.0,27.0,,243.0,0.47,
1877,GROUND WATER NEAR USV LIMITED HPSIDC BADDI AT BADDI INDUSTRIAL AREA,Groundwater,HIMACHAL PRADESH,2022,,,8.195,602.0,,2.28,2.0,21.0,,369.0,0.78,
1878,GROUND WATER (NEAR ELECTRICITY OFFICE BAROTIWALA) BAROTIWALA INDUSTRIAL AREA,Groundwater,HIMACHAL PRADESH,2022,,,7.765,1107.5,3.0,9.825,8.0,70.0,,595.5,0.35,
1879,GROUND WATER (NEAR ACME FORMULATION NALAGARH) NALAGARH INDUSTRIAL AREA,Groundwater,HIMACHAL PRADESH,2022,,,7.685,854.0,,9.855,2.0,21.0,,517.6,0.475,
1880,TUBEWELL OPPOSITE IIIT COLLEGE OF ENGINEERING NEAR INDUSTRIAL AREA JOHRON KALA AMB,Groundwater,HIMACHAL PRADESH,2022,,,7.45,1011.0,,2.11,,,,411.0,0.34,
1881,"BOREWELL NEAR JSV TANK, SWCA OFFICE AT GONDPUR, INDUSTRIAL AREA, PAONTA SAHIB",Groundwater,HIMACHAL PRADESH,2022,23.5,,7.8,620.5,1.1,6.09,,4.5,,298.5,0.695,
1882,BOREWELL NEAR OVERHEAD TANK OF IADA MEHATPUR INDUSTRIAL AREA,Groundwater,HIMACHAL PRADESH,2022,25.0,,6.7,747.0,,0.32,2.0,31.0,,505.0,,
2628,HAND PUMP NEAR THE BUS STOP AT WORKSHOP CHOWK,Groundwater,HIMACHAL PRADESH,2022,16.0,,7.85,445.0,,0.32,,,,306.0,0.29,
2629,HAND PUMP AT MANDI TOWN (NEAR CANARA BANK),Groundwater,HIMACHAL PRADESH,2022,21.5,,8.215,369.0,,0.695,,,,250.5,0.31,
2630,HANDPUMP NEAR EXIT GATE OF BUS STAND HAMIRPUR,Groundwater,HIMACHAL PRADESH,2022,24.4,,7.61,599.0,,1.21,2.0,19.5,,401.5,,
2631,HAND PUMP INSIDE THE BUS STAND AT NADAUN TOWN,Groundwater,HIMACHAL PRADESH,2022,25.75,,7.285,491.0,,1.89,2.0,13.8,,320.5,,
2632,HAND PUMP AT BILASPUR TOWN (NEAR LAXMINARAYAN TEMPLE),Groundwater,HIMACHAL PRADESH,2022,21.0,,7.48,711.5,,2.185,,,,486.5,0.28,
2633,HAND PUMP AT RECONGPEO,Groundwater,HIMACHAL PRADESH,2022,,,8.0,477.5,,6.47,,,,299.0,0.25,
2634,HAND PUMP NEAR VIJAYNAGAR TOTU SHIMLA,Groundwater,HIMACHAL PRADESH,2022,10.0,,7.96,287.0,,4.97,,,,183.0,,
2635,HAND PUMP NEAR NOGLI AT RAMPUR,Groundwater,HIMACHAL PRADESH,2022,,,7.955,392.0,,20.045,9.2,21.0,,257.0,0.25,
2636,HAND PUMP NEAR KANGRA TEMPLE,Groundwater,HIMACHAL PRADESH,2022,,,6.89,494.0,,2.68,2.0,17.0,,345.0,,
2637,HAND PUMP AT JWALAJI TEMPLE,Groundwater,HIMACHAL PRADESH,2022,,,6.93,760.0,,0.8,2.0,17.5,,468.5,,
2638,BOREWELL NEAR CHINTPURNI TEMPLE AT UNA TOWN,Groundwater,HIMACHAL PRADESH,2022,24.75,,7.51,428.0,,1.79,2.0,19.0,,292.5,,
2639,HAND PUMP NEAR CHAMUNDA DEVI TEMPLE,Groundwater,HIMACHAL PRADESH,2022,18.0,,7.345,130.5,,1.0,2.0,22.5,,90.0,,
2640,HAND PUMP NEAR SANSARPUR TERRACE INDUSTRIAL AREA,Groundwater,HIMACHAL PRADESH,2022,23.0,,6.845,420.0,,2.735,2.0,29.5,,286.5,,
2641,HAND PUMP NEAR TEXI STAND CHAMBA TOWN,Groundwater,HIMACHAL PRADESH,2022,15.0,,7.85,320.0,,1.91,2.0,17.0,,218.0,,
2642,HAND PUMP NEAR HOTEL PINE WOOD AT DALHOUSIE ROAD,Groundwater,HIMACHAL PRADESH,2022,14.0,,7.09,592.0,,2.28,2.0,13.0,,408.0,,
2645,HAND PUMP AT NAHAN NEAR POLICE POST GUNNUGHAT,Groundwater,HIMACHAL PRADESH,2022,,,7.88,649.5,1.1,1.6,,,,288.5,0.82,
2646,HAND PUMP NEAR MOGINANAD AT KALA AMB,Groundwater,HIMACHAL PRADESH,2022,,,7.255,949.5,,2.12,,,,426.0,0.595,
2647,HAND PUMP AT TAHLIWAL BAZAR,Groundwater,HIMACHAL PRADESH,2022,31.0,,7.55,617.0,,0.32,2.0,33.0,,392.0,,
2648,HAND PUMP AT KEYLONG,Groundwater,HIMACHAL PRADESH,2022,9.5,,7.725,351.5,,1.595,,,,239.5,0.515,
4434,BOREWELL NEAR UNA-HAROLI BRIDGE INDUSTRIAL AREA JEETPUR BEHRI,Groundwater,HIMACHAL PRADESH,2022,24.0,,7.21,416.0,,2.26,2.0,22.0,,223.5,,
4456,HANDPUMP NEAR SATSANG BHAWAN VILLAGE MUGLA,Groundwater,HIMACHAL PRADESH,2022,16.0,,7.16,280.5,,1.05,2.0,21.0,,191.5,,
4465,GROUND WATER INTAKE POINT OF BBMB AT VILL. HARABAGH,Groundwater,HIMACHAL PRADESH,2022,18.0,,7.485,545.0,,1.385,43.0,215.0,,372.5,0.5,
4467,"GROUND WATER NEAR LIFT WATER SUPPLY SCHEME AT DARI DHARAMSHALA AT HOTEL DHAULADHAR HEIGHTS DARI, DHARAMSHALA",Groundwater,HIMACHAL PRADESH,2022,,,7.21,158.0,,1.5,2.0,24.0,,110.5,,
4468,"GROUND WATER SUPPLY SCHEME NEAR MELA GROUND DARI, DHARAMSHALA",Groundwater,HIMACHAL PRADESH,2022,,,7.18,155.0,,0.73,2.0,24.0,,103.0,,
4472,GROUND WATER NEAR SUPPLY SCHEME AT NAGROTA BHAGWAN,Groundwater,HIMACHAL PRADESH,2022,,,6.78,198.5,,0.32,2.0,13.0,,132.5,,
4478,"LIFTING WATER SUPPLY SCHEME SHAMSHI, NEAR SABJI MANDI BHUNTER, TEHSIL KULLU",Groundwater,HIMACHAL PRADESH,2022,12.0,,7.9,202.0,,0.32,41.0,220.0,,137.0,,
4483,GROUND WATER SUPPLY SCHEME (MC UNA),Groundwater,HIMACHAL PRADESH,2022,27.0,,7.36,471.0,,1.46,2.0,27.0,,283.0,,
4484,"DRINKING WATER SUPPLY SCHEME NO. 7, SANOLI",Groundwater,HIMACHAL PRADESH,2022,22.75,,7.36,532.0,,1.865,2.0,19.0,,299.0,,
5249,GROUND WATER NEAR PULGHRAT BRIDGE ALONG NATIONAL HIGHWAY,Groundwater,HIMACHAL PRADESH,2022,20.0,,8.215,239.5,,0.83,,,,160.0,0.24,
5250,"BOREWELL IN THE PREMISES OF M/S BHAGWATI AUTOMOBILE, PLOT NO. 13, INDL AREA SAULI KHAD, DIST. MANDI",Groundwater,HIMACHAL PRADESH,2022,20.0,,6.885,226.0,,2.955,,,,150.5,0.585,
5258,"GROUUND WATER AT VPO SANOLI, SUB-TEHSIL MEHTAPUR (DRINKING WATER SUPPLY SCHEME)",Groundwater,HIMACHAL PRADESH,2022,23.75,,7.325,1032.0,,2.765,3.0,30.5,,578.5,,
2650,KHAZIAR LAKE,Pond/Tank,HIMACHAL PRADESH,2022,,15.0,7.7,7.35,112.5,1.0,2.485,66.0,807.0,,,
3864,RIVER MARKANDA AFTER CONFLUENCE OF RAMPUR JATTAN MOGINAND NALA,River,HIMACHAL PRADESH,2022,22.5,7.5,7.8,719.0,2.05,1.19,107.0,625.0,2.0,,,
3862,RIVER MARKANDA AFTER CONFLUENCE WITH SALANI KHAD AT MOGINAND KALA AMB,River,HIMACHAL PRADESH,2022,21.0,7.55,7.9,501.5,1.85,1.015,57.5,245.0,2.0,,,
30008,RIVER MARKANDA AT KALA AMB U/S (H.P),River,HIMACHAL PRADESH,2022,21.75,6.8,8.0,564.5,4.5,0.96,65090.0,233950.0,91.5,,,
1871,"RIVER MARKANDA AT SHAMBUWALA, DISTT. SIRMOUR",River,HIMACHAL PRADESH,2022,21.5,7.8,7.9,570.0,1.75,1.955,66.0,195.0,2.0,,,
2624,RIVER MARKANDA U/S KALA AMB,River,HIMACHAL PRADESH,2022,22.5,7.5,7.8,590.5,2.05,0.625,156.0,570.0,2.0,,,
1870,"SUKHANA NALLAH AT PARWANOO NEAR KALKA BARRIER, EXIT POINT OF H. P.",River,HIMACHAL PRADESH,2022,,12.5,6.1,7.65,822.5,30.5,7.335,801.0,812.5,,,
3861,"SALANI NALLAH NEAR BRIDGE, NH-7, MOGINAND KALA AMB",River,HIMACHAL PRADESH,2022,,20.0,7.65,7.65,455.5,2.05,0.91,156.5,570.0,,,
3863,RAMPUR JATTAN MOGINAND NALA BEFORE CONFLUENCE TO RIVER MARKANDA NEAR RADHA SWAMI SATSANG BHAWAN,River,HIMACHAL PRADESH,2022,,22.0,6.05,7.8,2702.5,13.3,1.57,7353.5,81140.0,,,
3865,"ROON NALLAH NEAR MEERPUR KOTLA, GURUDWARA",River,HIMACHAL PRADESH,2022,,23.5,7.5,7.8,477.0,1.9,1.045,95.5,317.0,,,
3867,SARVARI NALLAH BEFORE CONFLUENCE TO RIVER BEAS,River,HIMACHAL PRADESH,2022,,8.5,8.4,7.75,142.5,1.0,1.02,55.0,245.0,,,
3868,BARAGRAM NALLAH BEFORE CONFLUENCE TO RIVER BEAS,River,HIMACHAL PRADESH,2022,,6.5,8.95,7.95,168.5,1.0,0.93,56.0,225.0,,,
3875,SURAJMUKHI NALLAH U/S WSS GALAYANA D/S OF SHOOLINI UNIVERSITY,River,HIMACHAL PRADESH,2022,,13.0,7.3,7.9,734.0,1.9,7.84,9.5,70.5,,,
3879,"BHATIAN NALLAH U/S BHATIAN VILLAGE, NEAR TVS INDUSTRY, NALAGARH",River,HIMACHAL PRADESH,2022,,21.0,3.1,7.85,2696.0,23.0,5.285,171.0,932.5,,,
3881,"BHATIAN NALLAH D/S SARA TEXTILE, NALAGARH",River,HIMACHAL PRADESH,2022,,26.0,3.25,7.75,3191.5,17.0,5.85,461.0,810.5,,,
4029,TAALO NALA (FROM NAHAR TOWN) AT KHADDAR KA BAGH B/C TO RIVER MARKANDA,River,HIMACHAL PRADESH,2022,,20.5,7.25,7.8,552.0,1.9,3.23,187.5,865.0,,,
4034,SAHU NALLAH U/S BHURI SINGH SHEP,Drain/STP/WTP,HIMACHAL PRADESH,2022,,13.5,8.9,7.55,264.0,1.0,0.74,12.0,120.5,,,
4035,SAHU NALLAH D/S BHURI SINGH SHEP,Drain/STP/WTP,HIMACHAL PRADESH,2022,,14.0,8.8,7.5,277.0,1.0,1.3,17.5,151.0,,,
4036,"KUNNI PUL, VILL SAMAHU, PO KUNIHAR, TEHSIL ARKI",Drain/STP/WTP,HIMACHAL PRADESH,2022,,12.5,7.95,8.0,352.0,1.4,3.27,11.5,39.5,,,
4425,RAW WATER FOR LWSS OF CHURAT NALLAH,Drain/STP/WTP,HIMACHAL PRADESH,2022,,10.5,8.0,7.95,1003.0,1.0,0.935,86.0,801.0,,,
4426,RAW WATER FOR LWSS OF JAGROTI NALLAH,Drain/STP/WTP,HIMACHAL PRADESH,2022,,11.0,8.0,8.1,779.0,1.0,0.795,111.0,801.0,,,
4430,LIFT NALLAH BEFORE CONFLUENCE TO ASHWANI KHAD NEAR DOGRHA BRIDGE,Drain/STP/WTP,HIMACHAL PRADESH,2022,,15.5,6.8,7.75,1646.5,29.95,7.06,465.5,819.5,,,
4454,JARANGLA NALLAH U/S WATER SUPPLY SCHEME,Drain/STP/WTP,HIMACHAL PRADESH,2022,,13.0,8.95,7.65,179.5,1.0,1.22,14.0,183.5,,,
4455,KLUIN NALLAH U/S WATER SUPPLY SCHEME,Drain/STP/WTP,HIMACHAL PRADESH,2022,,12.5,9.45,7.65,281.5,1.0,0.73,17.5,147.0,,,
4462,SAINJ NALLAH (U/S SAINJ WATER SUPPLY SCHEME AT DARGI),Drain/STP/WTP,HIMACHAL PRADESH,2022,,13.0,7.7,8.05,1182.0,1.0,1.37,111.0,801.0,,,
4463,DHANESHAR NALLAH (U/S SAINJ WATER SUPPLY SCHEME) NEAR GYASI MATA MANDIR,Drain/STP/WTP,HIMACHAL PRADESH,2022,,12.5,7.6,8.0,1255.5,1.0,1.61,141.0,801.0,,,
4464,ALHI KHAD NEAR INTAKE WSS AT VILL. NOG,Drain/STP/WTP,HIMACHAL PRADESH,2022,,18.5,8.9,8.15,367.5,1.0,1.76,58.5,215.0,,,
4466,JARANGLA NALLAH D/S WATER SUPPLY SCHEME,Drain/STP/WTP,HIMACHAL PRADESH,2022,,13.0,9.05,7.7,648.5,1.0,1.2,30.0,810.5,,,
4474,HALOG NALLAH NEAR HALOG WATER SUPPLY SCHEME,Drain/STP/WTP,HIMACHAL PRADESH,2022,,10.5,9.5,8.0,757.0,1.0,1.055,15.0,188.5,,,
4475,"MACHADA NALLAH, MAJHOUTI WATER SUPPLY SCHEME NEAR NIRATH",Drain/STP/WTP,HIMACHAL PRADESH,2022,,11.0,9.55,8.0,768.5,1.0,1.015,14.0,801.0,,,
4476,MANALSU NALLAH NEAR WATER SUPPLY SCHEME FOR MANALI TOWN,Drain/STP/WTP,HIMACHAL PRADESH,2022,,4.5,9.2,7.6,156.0,1.0,0.845,53.5,215.0,,,
4477,KHALADA NALLAH NEAR WATER SUPPLY SCHEME FOR KULLU TOWN,Drain/STP/WTP,HIMACHAL PRADESH,2022,,7.5,8.65,7.95,1146.5,1.0,1.45,47.5,260.0,,,
4480,SURAJMUKHI NALLAH D/S STP AT U/S OF SHOOLINI UNIVERSITY SAMTI SOLAN,River,HIMACHAL PRADESH,2022,,12.5,7.85,7.9,3119.0,7.75,7.68,56.0,282.5,,,
4481,HATHLI NALLAH LIFT WATER SUPPLY SCHEME FOR MUNICIPAL COUNCIL HAMIRPUR,River,HIMACHAL PRADESH,2022,,20.0,8.0,7.65,339.5,1.0,3.3,3.0,31.5,,,
4482,LIFT WATER SUPPLY SCHEME (PANJARAR) AND BHOTA ROPARI & UJHAN,River,HIMACHAL PRADESH,2022,,20.5,7.8,7.6,300.5,1.0,1.21,6.5,91.5,,,
5253,"HURLA NALLA D/S HURLA BRIDGE, VPO HURLA, TEHSIL BHUNTER, DIS. KULLU",River,HIMACHAL PRADESH,2022,,9.5,7.3,8.05,111.5,1.0,0.82,76.0,355.0,,,
5257,"KALAM NALLA D/S OF MSW PROCESSING SITE AT CHOWRI, DIST. CHAMBA",River,HIMACHAL PRADESH,2022,,15.0,8.75,7.55,173.5,1.0,1.275,4.5,812.5,,,
1001,RIVER BEAS AT U/S MANALI,River,HIMACHAL PRADESH,2022,9.5,8.55,7.75,238.5,,0.77,60.5,317.0,,,,
2601,RIVER BEAS AT D/S MANALI,River,HIMACHAL PRADESH,2022,6.0,8.9,7.77,100.5,1.8,0.91,847.0,1070.0,,,,
4444,RIVER BEAS D/S OF WASTE PROCESSING FACILITY AT MANALI,River,HIMACHAL PRADESH,2022,6.0,8.65,7.8,86.5,1.6,1.085,855.0,1070.0,,,,
4037,RIVER BEAS D/S MANALSU NALLAH,River,HIMACHAL PRADESH,2022,5.5,8.8,7.76,102.5,,1.045,59.0,280.0,,,,
3866,RIVER BEAS U/S BEFORE CONF. OF MANALSU NALLAH,River,HIMACHAL PRADESH,2022,4.5,8.8,7.865,177.0,,1.05,52.5,245.0,,,,
2602,"RIVER BEAS, U/S KULLU",River,HIMACHAL PRADESH,2022,7.0,8.35,7.985,100.5,,0.955,136.5,940.0,,,,
4445,RIVER BEAS D/S OF WASTE PROCESSING FACILITY AT KULLU,River,HIMACHAL PRADESH,2022,10.5,8.75,8.005,181.0,1.1,1.01,855.0,1070.0,,,,
1002,RIVER BEAS D/S KULLU,River,HIMACHAL PRADESH,2022,10.5,9.0,7.95,106.0,1.4,1.155,525.0,1070.0,,,,
1003,RIVER BEAS D/S AUT,River,HIMACHAL PRADESH,2022,11.5,7.85,7.895,90.5,,1.39,76.5,375.0,,,,
2603,"RIVER BEAS, D/S PANDOH DAM",River,HIMACHAL PRADESH,2022,16.5,8.9,8.08,129.0,,1.085,76.0,355.0,,,,
1005,RIVER BEAS AT EXIT OF DEHAR POWER HOUSE,River,HIMACHAL PRADESH,2022,19.0,9.15,7.745,210.0,,0.81,109.5,395.0,,,,
1550,"BEAS RIVER, U/S OF MANDI TOWN",River,HIMACHAL PRADESH,2022,17.0,8.75,8.08,140.0,,0.915,54.5,215.0,,,,
1006,RIVER BEAS D/S MANDI TOWN,River,HIMACHAL PRADESH,2022,16.0,8.35,8.035,226.0,1.1,0.98,507.0,975.0,,,,
2604,RIVER BEAS AT D/S JAISINGHPUR,River,HIMACHAL PRADESH,2022,17.5,8.45,7.765,247.0,,6.98,36.0,182.5,,,,
1007,RIVER BEAS AT D/S ALAMPUR,River,HIMACHAL PRADESH,2022,14.0,8.75,7.82,237.0,,6.27,25.5,181.0,,,,
3855,"RIVER BEAS D/S NADAUN BRIDGE, VILL BHADOLI",River,HIMACHAL PRADESH,2022,22.5,8.1,7.765,314.0,2.0,5.12,48.0,118.5,,,,
1009,RIVER BEAS AT D/S PONG DAM,River,HIMACHAL PRADESH,2022,18.5,7.0,7.625,193.5,,6.95,48.0,813.5,,,,
1008,RIVER BEAS AT D/S DEHRAGOPIPUR,River,HIMACHAL PRADESH,2022,20.5,8.1,7.78,276.0,,8.56,12.5,111.5,,,,
4435,RIVER BEAS U/S SUJANPUR TIHRA,River,HIMACHAL PRADESH,2022,19.35,8.45,7.805,275.5,,4.46,43.0,458.5,,,,
4436,RIVER BEAS D/S SUJANPUR TIHRA,River,HIMACHAL PRADESH,2022,19.85,8.35,7.9,290.0,,6.19,121.0,811.0,,,,
4437,RIVER BEAS U/S NADAUM TOWN,River,HIMACHAL PRADESH,2022,19.35,8.45,7.68,281.0,,4.21,9.5,72.0,,,,
4438,RIVER BEAS D/S NADAUN TOWN AFTER CONFLUENCE OF MAAN KHAD,River,HIMACHAL PRADESH,2022,19.3,8.3,7.67,295.5,,5.28,32.5,187.5,,,,
4443,RIVER BEAS AT RAISON,River,HIMACHAL PRADESH,2022,7.0,8.65,7.815,97.0,,1.0,62.5,320.0,,,,
30083,RIVER BEAS AT TALWARA (PONG DAM),River,HIMACHAL PRADESH,2022,20.75,9.0,8.5,192.0,1.55,0.42,171.5,366.5,,,,
1867,RIVER SUTLEJ BEFORE CONF. WITH RIVER SPITI AT KHAB,River,HIMACHAL PRADESH,2022,10.5,9.15,8.22,377.5,,0.465,13.0,804.0,,,,
2611,RIVER SUTLEJ AFTER CONF. WITH RIVER SPIT AT KHAB,River,HIMACHAL PRADESH,2022,10.0,9.25,8.305,363.0,,0.485,14.0,855.0,,,,
3872,RIVER SUTLEJ D/S TIDONG HEP,River,HIMACHAL PRADESH,2022,9.75,9.1,8.33,1213.5,,0.455,9.5,855.0,,,,
4448,RIVER SUTLEJ BEFORE CONFLUENCES WITH RIVER TIDONG,River,HIMACHAL PRADESH,2022,9.5,9.15,8.29,1835.0,,0.47,21.0,176.0,,,,
4449,RIVER SUTLEJ AFTER CONFLUENCES WITH RIVER TIDONG,River,HIMACHAL PRADESH,2022,9.75,9.1,8.31,2130.5,,0.45,86.0,801.0,,,,
4452,RIVER SUTLEJ BEFORE CONFLUENCES OF RIVER BASPA,River,HIMACHAL PRADESH,2022,9.5,9.15,8.305,1403.0,,0.485,17.5,803.5,,,,
3871,RIVER SUTLEJ D/S POWER HOUSE KASHANG HEP,River,HIMACHAL PRADESH,2022,9.5,9.05,8.27,1725.0,,0.46,12.0,802.5,,,,
3870,RIVER SUTLEJ AFTER CONF. OF RIVER BASPA AT KARCHAM DAM,River,HIMACHAL PRADESH,2022,10.0,9.0,8.175,1350.5,,0.61,14.0,802.0,,,,
1389,RIVER SUTLEJ AT WANGTOO BRIDGE,River,HIMACHAL PRADESH,2022,10.0,9.0,7.64,1400.5,,1.43,22.5,819.5,,,,
4453,RIVER SUTLEJ AFTER CONFLUENCES OF RIVER BASPA,River,HIMACHAL PRADESH,2022,10.0,9.05,7.58,996.5,,0.8,11.5,803.0,,,,
3869,RIVER SUTLEJ D/S TRT OF RAMPUR HYDEL ELECTRIC PROJECT,River,HIMACHAL PRADESH,2022,11.0,8.85,7.84,1302.0,,0.73,17.5,807.0,,,,
1086,RIVER SUTLEJ AT U/S RAMPUR,River,HIMACHAL PRADESH,2022,11.0,8.85,7.615,624.0,,1.03,32.0,816.0,,,,
1087,RIVER SUTLEJ AT D/S RAMPUR,River,HIMACHAL PRADESH,2022,11.0,8.95,7.62,672.0,,0.595,26.5,803.5,,,,
1013,RIVER SUTLEJ AT U/S TATAPANI,River,HIMACHAL PRADESH,2022,11.0,8.8,7.935,1344.0,,0.735,13.0,804.5,,,,
4446,RIVER SUTLEJ U/S IANDFILL SITE RAMPUR,River,HIMACHAL PRADESH,2022,10.75,8.85,7.595,619.0,,2.33,16.5,807.0,,,,
4447,RIVER SUTLEJ D/S LANDFILL SITE RAMPUR,River,HIMACHAL PRADESH,2022,10.75,8.85,7.585,1288.0,,0.57,176.0,804.5,,,,
4032,RIVER SUTLEJ D/S ACC BARMANA,River,HIMACHAL PRADESH,2022,19.0,9.25,7.97,301.0,,2.155,134.5,565.0,,,,
4033,RIVER SUTLEJ NEAR LUHNOO GROUND,River,HIMACHAL PRADESH,2022,19.0,9.05,7.95,314.0,1.4,1.355,187.0,675.0,,,,
4450,RIVER SUTLEJ BEFORE CONFLUENCE WITH GANVI KHAND,River,HIMACHAL PRADESH,2022,10.75,9.05,7.695,629.5,,1.565,49.0,808.5,,,,
4451,RIVER SUTLEJ AFTER CONFLUENCE WITH GANVI KHAD,River,HIMACHAL PRADESH,2022,10.75,9.05,7.61,672.0,,1.73,37.0,803.4,,,,
30009,RIVER SUTLEJ AT NANGAL (H.P.),River,HIMACHAL PRADESH,2022,19.75,8.75,8.1,244.5,2.7,0.92,27020.0,110.0,17.0,,,
1014,RIVER SUTLEJ U/S OF EXIT POINT OF DEHAR POWER HOUSE,River,HIMACHAL PRADESH,2022,19.0,9.35,8.115,205.5,1.2,0.86,57.5,280.0,,,,
1015,RIVER SUTLEJ D/S OF EXIT POINT OF DEHAR POWER HOUSE,River,HIMACHAL PRADESH,2022,19.0,9.25,8.1,218.5,,1.205,99.0,410.0,,,,
1016,RIVER SUTLEJ D/S BHAKHRA,River,HIMACHAL PRADESH,2022,22.0,8.9,7.36,248.5,,5.77,22.5,120.5,,,,
30087,"RIVER SUTLEJ U/S AT OLINDA, NEAR BHAKRA DAM, H.P.",River,HIMACHAL PRADESH,2022,19.5,9.6,8.15,233.5,3.0,0.37,1760.0,8850.0,22.0,,,
30088,"RIVER SUTLEJ D/S OLINDA, NEAR BHAKRA DAM, H.P.",River,HIMACHAL PRADESH,2022,19.5,9.25,8.2,229.5,1.4,0.37,341.0,1865.0,8.0,,,
1088,RIVER RAVI AT U/S MADHOPUR,River,HIMACHAL PRADESH,2022,20.0,7.65,7.495,233.0,,4.41,12.0,810.5,,,,
1089,RIVER RAVI U/S CHAMBA,River,HIMACHAL PRADESH,2022,14.0,8.9,7.56,195.0,,2.68,7.5,468.5,,,,
2614,RIVER RAVI CHAMERA-I RESERVOIR,River,HIMACHAL PRADESH,2022,14.0,8.95,7.505,240.0,,3.68,14.0,810.5,,,,
2615,RIVER RAVI D/S CHAMERA- III HEP DAM,River,HIMACHAL PRADESH,2022,13.5,9.0,7.675,156.0,,3.26,17.5,280.5,,,,
2613,RIVER RAVI AT D/S OF CHAMBA TOWN,River,HIMACHAL PRADESH,2022,13.5,8.8,7.645,189.5,,6.06,43.0,812.0,,,,
3873,RIVER RAVI U/S STP AT BHARGA,River,HIMACHAL PRADESH,2022,14.0,8.75,7.67,170.0,,5.19,12.0,97.0,,,,
3874,RIVER RAVI D/S STP AT BHAGOT,River,HIMACHAL PRADESH,2022,14.0,8.7,7.67,163.0,,6.94,17.5,133.5,,,,
1290,RIVER PARVATI BEFORE CONF. TO RIVER BEAS AT BHUNTER,River,HIMACHAL PRADESH,2022,10.0,8.2,7.86,72.5,,1.155,101.0,565.0,,,,
2605,RIVER PARVATI AT U/S MANIKARAN,River,HIMACHAL PRADESH,2022,6.5,8.5,7.735,67.0,,0.98,32.0,114.0,,,,
2606,RIVER PARVATI AT D/S MANIKARAN,River,HIMACHAL PRADESH,2022,7.5,8.4,7.605,70.5,,1.06,34.0,162.0,,,,
1551,RIVER SIRSA U/S SITOMAJRI NALLAH,River,HIMACHAL PRADESH,2022,18.0,7.15,7.765,578.5,6.55,5.19,36.0,479.0,,,,
1552,RIVER SIRSA D/S NALAGARH BRIDGE,River,HIMACHAL PRADESH,2022,20.0,6.4,7.85,1109.0,7.1,6.215,48.0,152.5,,,,
1868,RIVER SIRSA D/S NALAGARH TOWN,River,HIMACHAL PRADESH,2022,20.5,7.55,7.815,859.5,2.6,4.77,25.5,283.5,,,,
4485,RIVER SIRSA U/S SANDHOLI NALLAH,River,HIMACHAL PRADESH,2022,20.0,4.0,7.985,474.0,3.3,4.67,40.5,198.5,,,,
4487,RIVER SIRSA D/S HOUSING BOARD NALLAH,River,HIMACHAL PRADESH,2022,20.5,4.55,7.595,1014.5,5.4,9.725,56.0,185.5,,,,
4489,RIVER SIRSA AFTER CONF. TO RIVER RATTA,River,HIMACHAL PRADESH,2022,20.0,5.75,7.745,1129.0,14.5,3.89,71.0,296.5,,,,
2616,RIVER BAIRA SIUL D/S SURGANI,River,HIMACHAL PRADESH,2022,13.5,8.9,7.43,215.5,,4.21,14.0,810.5,,,,
2607,SUKETI KHAD BEFORE CONF. WITH RIVER BEAS,River,HIMACHAL PRADESH,2022,16.5,7.95,7.985,282.5,1.4,1.165,855.0,1070.0,2.0,,,
2608,RIVER BINWA AT D/S PAPROLA/BAIJNATH,River,HIMACHAL PRADESH,2022,18.5,8.4,7.57,166.5,,4.52,24.0,151.0,,,,
2609,NEUGAL KHAD D/S THURAL,River,HIMACHAL PRADESH,2022,18.0,8.9,7.565,190.0,,5.81,17.5,147.0,,,,
2610,RIVER SPITI BEFORE CONF.WITH RIVER SUTLEJ AT KHAB,River,HIMACHAL PRADESH,2022,10.0,9.35,8.295,339.5,,0.465,10.5,803.4,,,,
2612,RIVER BASPA U/S RESERVOIR BASPA HEP AT KUPPA,River,HIMACHAL PRADESH,2022,9.25,9.5,8.265,1247.5,,0.55,18.0,801.0,,,,
3856,RIVER SWAN U/S INDUSTRIAL AREA GAGRET,River,HIMACHAL PRADESH,2022,26.75,7.4,7.68,363.0,2.0,5.67,14.0,191.5,,,,
3857,RIVER SWAN D/S INDUSTRIAL AREA GAGRET,River,HIMACHAL PRADESH,2022,26.75,7.3,7.715,376.0,2.5,4.235,30.0,287.0,,,,
3858,RIVER SWAN U/S SANTOSHGARH BRIDGE,River,HIMACHAL PRADESH,2022,21.0,7.4,7.565,423.5,2.0,6.705,14.0,126.5,,,,
3859,RIVER SWAN U/S UNA TOWN AT GHALLUWAL BRIDGE,River,HIMACHAL PRADESH,2022,26.5,7.5,7.645,396.5,2.0,4.81,20.0,477.0,,,,
4030,RIVER SWAN BEFORE CONF. OF GARNI KHAD AT CHURURU,River,HIMACHAL PRADESH,2022,26.0,7.6,7.685,377.5,,2.855,19.5,152.5,,,,
4031,RIVER SWAN AFTER CONF. GARNI KHAD AT CHURURU,River,HIMACHAL PRADESH,2022,26.0,7.7,7.745,392.0,2.0,8.08,40.5,473.5,,,,
1869,RIVER SWAN D/S BELA BATHARI (BHANGLA),River,HIMACHAL PRADESH,2022,22.0,7.55,7.52,458.0,3.5,5.37,25.5,159.0,,,,
4038,RIVER TIRTHAN BEFORE CONF. TO RIVER SUTLEJ,River,HIMACHAL PRADESH,2022,11.0,8.2,7.935,84.0,,1.6,35.0,180.0,,,,
2617,RIVER PABBAR AT U/S DHAMBARI,River,HIMACHAL PRADESH,2022,8.0,8.5,7.535,554.5,,0.74,57.0,803.0,,,,
2618,RIVER PABBAR AT U/S ROHRU,River,HIMACHAL PRADESH,2022,10.0,8.2,7.835,696.5,,0.73,56.0,803.5,,,,
4039,RIVER PABBAR U/S HATKOTI,River,HIMACHAL PRADESH,2022,13.0,7.9,7.855,518.5,,0.755,12.0,464.5,,,,
4479,ASHWANI KHAD U/S OF SADHUPUL VILLAGE (NEARBY 800 METERS U/S OF THE BRIDGE),River,HIMACHAL PRADESH,2022,13.0,6.65,7.52,363.0,2.75,6.845,221.0,930.0,,,,
4441,RIVER GIRI U/S PROPOSED SITE OF SRI RENUKAJI DAM SITE.,River,HIMACHAL PRADESH,2022,21.5,7.8,8.035,435.0,1.55,3.97,32.5,175.0,,,,
4442,RIVER GIRI D/S PROPOSED SITE OF SRI RENUKAJI DAM SITE NEAR BRIDGE AT DADAHU- RENUKAJI,River,HIMACHAL PRADESH,2022,21.5,7.8,7.91,441.5,1.7,0.775,38.0,225.0,,,,
4429,ASHWANI KHAD AFTER CONFLUENCE OF LIFT NALLAH NEAR DOGRHA BRIDGE,River,HIMACHAL PRADESH,2022,20.55,7.35,7.82,1054.5,4.2,3.89,462.5,858.5,461.0,,,
4461,"ASHWANI KHAD D/S OF VILLAGE SADHUPIL, TEHSIL KANDAGHAT, DISTRICT SOLAN.",River,HIMACHAL PRADESH,2022,13.0,6.9,7.54,496.0,2.2,7.35,86.0,479.0,,,,
2620,ASHWANI KHAD U/S OF YASHWANT NAGAR BEFORE CONF. WITH RIVER GIRI AT YASHWANT NAGAR,River,HIMACHAL PRADESH,2022,12.5,6.7,7.84,403.5,2.4,5.645,14.0,55.0,,,,
4023,MANJHI KHAD U/S DHARAMSHALA OF KHANIYARA,River,HIMACHAL PRADESH,2022,13.5,8.25,7.34,495.5,,3.57,17.5,77.0,,,,
4024,MANJHI KHAD D/S DHARAMSHALA AT CHETRU,River,HIMACHAL PRADESH,2022,15.5,7.95,7.52,454.0,,4.52,40.5,130.5,,,,
4025,MOL KHAD U/S PALAMPUR,River,HIMACHAL PRADESH,2022,15.0,8.35,7.685,134.0,,2.62,14.0,85.5,,,,
4026,MOL KHAD D/S PALAMPUR,River,HIMACHAL PRADESH,2022,14.5,8.1,7.715,156.5,,3.13,14.0,97.5,,,,
4457,BANER KHAD U/S CHAMUNDA TEMPLE,River,HIMACHAL PRADESH,2022,15.0,8.5,7.56,121.5,,4.6,14.0,811.0,,,,
4458,BANER KHAD D/S CHAMUNDA TEMPLE,River,HIMACHAL PRADESH,2022,15.0,8.25,7.605,131.0,,4.97,20.0,813.0,,,,
4460,CHARAN KHAND U/S BHAGSUNAG,River,HIMACHAL PRADESH,2022,13.0,9.05,7.505,101.0,,1.92,14.0,78.5,,,,
4428,ASHWINI KHAD U/S OF WEIR SITE OF WTP NEAR ASHWANI BRIDGE,River,HIMACHAL PRADESH,2022,14.5,7.4,8.035,1451.5,4.3,3.74,146.0,819.5,17.0,,,
4424,RAW WATER FOR LWSS OF NAUTI KHAD AT GUMMA (BASANTPUR),River,HIMACHAL PRADESH,2022,12.5,7.95,8.075,244.0,,0.995,62.0,802.0,2.0,,,
4432,DHAULI KHAD AT CHARAN GANGA MEDI,River,HIMACHAL PRADESH,2022,26.0,7.0,7.68,357.0,1.4,2.775,14.5,76.0,,,,
4431,SHIKARI KHAD BEFORE CONFLUENCE TO RIVER PABBAR NEAR HRTC ROHRU BUS STAND,River,HIMACHAL PRADESH,2022,14.0,6.9,7.765,701.5,,1.005,803.0,803.5,,,,
2626,RIVER BATTA U/S PAONTA AT KISHANPURA,River,HIMACHAL PRADESH,2022,20.5,7.8,7.86,426.5,1.65,0.89,33.5,241.5,,,,
2627,RIVER BATTA BEFORE CONFLUENCE TO YAMUNA,River,HIMACHAL PRADESH,2022,21.0,7.8,7.935,436.0,1.75,0.95,33.0,205.0,,,,
1090,RIVER SAINJ D/S LARJI,River,HIMACHAL PRADESH,2022,10.0,7.95,7.84,86.0,,2.95,56.0,245.0,,,,
1871,"RIVER MARKANDA AT SHAMBUWALA, DISTT. SIRMOUR",River,HIMACHAL PRADESH,2022,21.5,7.8,7.895,570.0,1.8,1.955,71.5,195.0,,,,
2624,RIVER MARKANDA U/S KALA AMB,River,HIMACHAL PRADESH,2022,22.5,7.5,7.83,590.5,2.05,0.725,156.0,570.0,,,,
3862,RIVER MARKANDA AFTER CONFLUENCE WITH SALANI KHAD AT MOGINAND KALA AMB,River,HIMACHAL PRADESH,2022,21.0,7.55,7.875,501.5,1.85,1.015,57.5,245.0,,,,
3864,RIVER MARKANDA AFTER CONFLUENCE OF RAMPUR JATTAN MOGINAND NALA,River,HIMACHAL PRADESH,2022,22.5,7.5,7.79,719.0,2.05,1.19,107.0,625.0,,,,
4433,RIVER SWAN D/S OF UNA AT RAMPUR BRIDGE,River,HIMACHAL PRADESH,2022,27.0,7.5,7.695,403.5,2.5,7.8,30.0,819.5,,,,
4470,BATHER KHAD WATER SUPPLY SCHEME AT DAL LAKE,River,HIMACHAL PRADESH,2022,11.0,9.15,7.47,325.5,,4.21,14.0,90.5,,,,
4471,"NEUGAL KHAD NEAR WATER SUPPLY SCHEME AT BANDLA, PALAMPUR",River,HIMACHAL PRADESH,2022,13.0,9.2,7.57,194.5,,2.02,14.0,71.5,,,,
4486,RIVER BALD D/S LANDFILLSITE AT BADDI,River,HIMACHAL PRADESH,2022,21.0,4.8,7.885,807.0,7.6,7.05,48.0,185.5,,,,
4488,RIVER RATTA BEFORE CONF. TO RIVER SIRSA,River,HIMACHAL PRADESH,2022,20.0,5.0,7.655,864.5,81.25,6.65,48.0,484.5,,,,
5248,"RIVER UHL D/S OF IIT, MANDI",River,HIMACHAL PRADESH,2022,22.0,8.4,7.895,158.0,,0.965,68.5,355.0,,,,
5251,SUKETI KHAD D/S SWM SITE AT SUNDER NAGAR,River,HIMACHAL PRADESH,2022,17.5,5.45,7.73,359.5,1.65,2.49,502.0,975.0,,,,
5252,SEER KHAD U/S INTAKE POINT OF WSS GHUMARWIN TOWN,River,HIMACHAL PRADESH,2022,20.5,8.8,8.205,311.5,,1.29,57.5,210.0,,,,
5254,RIVER BHAGGA U/S BEFORE CONFLUENCE TO RIVER CHENAB,River,HIMACHAL PRADESH,2022,5.0,9.25,7.98,140.0,,0.68,32.0,135.0,,,,
5255,RIVER CHANDRA U/S BEFORE CONFLUENCE TO RIVER CHENAB,River,HIMACHAL PRADESH,2022,5.0,9.25,7.81,136.0,,0.605,34.0,145.0,,,,
5256,RIVER CHENAB D/S AT TANDI (L & S),River,HIMACHAL PRADESH,2022,5.5,9.45,8.01,141.0,,0.8,31.5,145.0,,,,
5292,"RIVER GIRI AT NIHARI, KOTKHAL",River,HIMACHAL PRADESH,2022,10.5,8.2,7.795,71.5,,0.78,19.0,230.0,,,,
30013,RIVER KOSHALYA AT U/S PARWANOO,River,HIMACHAL PRADESH,2022,20.5,8.6,8.2,359.5,,0.975,572.5,80085.0,23.5,,,
1553,RIVER YAMUNA U/S PAONTA SAHIB,River,HIMACHAL PRADESH,2022,22.5,7.9,7.955,549.5,2.0,0.84,43.5,187.0,,,,
1554,RIVER YAMUNA D/S PAONTA SAHIB,River,HIMACHAL PRADESH,2022,20.5,7.85,8.015,383.0,2.0,0.85,97.5,300.0,,,,
4439,RIVER YAMUNA U/S SUN PHARMACEUTICALS,River,HIMACHAL PRADESH,2022,21.5,7.9,8.055,465.0,2.5,0.655,33.0,245.0,,,,
4440,RIVER YAMUNA D/S SUN PHARMACEUTICALS,River,HIMACHAL PRADESH,2022,21.0,7.75,7.98,348.0,2.05,0.67,96.0,300.0,,,,
