stn_code,monitoring_location,water_body_type,state,year,temperature_avg,do_avg,ph_avg,conductivity_avg,bod_avg,nitrate_avg,fecal_coliform_avg,total_coliform_avg,fecal_streptococci_avg,total_dissolved_solids_avg,fluoride_avg,arsenic_avg
1510,RIVER TONS AT TIUNI (HIMACHAL PRADESH/UTTRA KHAND BORDER),River,HIMACHAL PRADESH,2022,16.0,8.05,7.83,527.5,,1.135,17.5,463.9,,,,
4027,RIVER GIRI D/S RAJGARH TOWN,River,HIMACHAL PRADESH,2022,23.5,7.9,7.91,417.0,1.6,0.755,33.0,170.0,,,,
4028,"RIVER GIRI D/S KALGIDHAR TRUST, BARU SAHIB",River,HIMACHAL PRADESH,2022,23.5,7.8,8.02,481.0,1.55,0.775,32.5,205.0,,,,
4427,RIVER GIRI U/S CHAILLA,River,HIMACHAL PRADESH,2022,15.0,7.8,7.705,807.0,,1.365,10.5,803.4,,,,
2621,RIVER GIRI AT D/S YASHWANT NAGAR AFTER CONF. WITH ASHWANI KHAD AT YASHWANT NAGAR- NEAR SHANI MANDIR,River,HIMACHAL PRADESH,2022,12.0,7.75,7.92,413.5,8.6,6.565,801.0,813.0,,,,
3876,RIVER GIRI AFTER CONFLUENCE OF ASHWANI RIVER AT VILLAGE MARYOG,River,HIMACHAL PRADESH,2022,12.5,8.2,8.01,457.0,3.1,4.19,40.5,810.5,,,,
2622,RIVER GIRI AT U/S CCI MINES AT VILLAGE NADI,River,HIMACHAL PRADESH,2022,23.5,7.55,8.045,694.5,1.4,0.585,23.0,105.0,,,,
2623,RIVER GIRI D/S SATAUN,River,HIMACHAL PRADESH,2022,23.0,7.75,7.965,699.5,1.55,0.66,26.5,130.0,,,,
3877,RIVER GIRI U/S LWSS AT SAINJ,River,HIMACHAL PRADESH,2022,16.0,7.65,7.755,830.5,,1.595,21.5,807.0,,,,
3878,RIVER GIRI D/S LWSS AT SAINJ,River,HIMACHAL PRADESH,2022,15.5,7.7,7.77,830.5,,2.945,18.0,808.5,,,,
3860,"RIVER GIRI D/S CEMENT CORPORATION OF INDIA, RAJBAN AT BANGRAN BRIDGE",River,HIMACHAL PRADESH,2022,22.5,7.7,7.88,638.5,1.45,0.615,25.0,108.0,,,,
2619,RIVER PABBAR D/S SWARAKUDDU,River,HIMACHAL PRADESH,2022,13.5,8.0,7.84,535.5,,0.74,14.5,852.0,,,,
4473,RIVER GIRI D/S PROPOSED SITE OF RENUKA DAM,River,HIMACHAL PRADESH,2022,23.0,7.8,8.0,479.0,1.8,0.765,40.5,260.0,,,,
