stn_code,monitoring_location,water_body_type,state,year,temperature_avg,do_avg,ph_avg,conductivity_avg,bod_avg,nitrate_avg,fecal_coliform_avg,total_coliform_avg,fecal_streptococci_avg,total_dissolved_solids_avg,fluoride_avg,arsenic_avg
1606,WELL (PUBLIC )OPPOSITE S.B.SCHOOL,Groundwater,LAKSHADWEEP,2021,28.5,,7.3,714.0,,,,,,478.0,,
1600,WELL C/O ANDAM PALLI,Groundwater,LAKSHADWEEP,2021,29.3,,7.1,877.0,,,,,,588.0,,
4575,WELL C/O BEEREADAM,Groundwater,LAKSHADWEEP,2021,29.45,,6.85,974.0,,,,,,633.5,,
4564,WELL C/O BELAVILATHA PALLI,Groundwater,LAKSHADWEEP,2021,30.5,,6.8,1379.5,,,,,,897.0,,
1601,WELL C/O CIRCUIT HOUSE,Groundwater,LAKSHADWEEP,2021,29.0,,7.2,937.0,,,,,,628.0,,
4570,WELL C/O FRIENDS COMMON CLUB,Groundwater,LAKSHADWEEP,2021,30.4,,7.3,1356.0,,,,,,881.5,,
1602,"WELL C/O GOVT. PRESS,",Groundwater,LAKSHADWEEP,2021,29.05,,7.5,781.0,,,,,,523.5,,
4552,WELL C/O HIGH SCHOOL,Groundwater,LAKSHADWEEP,2021,29.55,,7.25,1097.0,,,,,,735.0,,
4576,WELL C/O HUSSAIN MANZIL,Groundwater,LAKSHADWEEP,2021,30.65,,6.8,675.0,,,,,,439.0,,
4554,WELL C/O I.G HOSPITAL,Groundwater,LAKSHADWEEP,2021,29.0,,7.2,861.0,,,,,,577.0,,
4553,WELL C/O J.B. SCHOOL (N),Groundwater,LAKSHADWEEP,2021,27.0,,7.4,802.0,,,,,,537.0,,
4562,WELL C/O JBS (C ),Groundwater,LAKSHADWEEP,2021,29.6,,7.35,1089.0,,,,,,708.0,,
1596,WELL C/O KADAT PALLI,Groundwater,LAKSHADWEEP,2021,28.8,,7.2,715.0,,,,,,479.0,,
4550,WELL C/O KENDRIYA VIDYALAYA,Groundwater,LAKSHADWEEP,2021,29.9,,7.5,1126.5,,,,,,754.5,,
4565,WELL C/O LAGOONS BATH,Groundwater,LAKSHADWEEP,2021,30.4,,6.6,860.0,,,,,,559.0,,
4569,WELL C/O MANDALI,Groundwater,LAKSHADWEEP,2021,30.65,,7.5,1613.5,,,,,,1049.0,,
4574,WELL C/O MOULA PALL,Groundwater,LAKSHADWEEP,2021,29.9,,7.1,609.5,,,,,,396.5,,
1604,WELL C/O MPSAF QUARTER,Groundwater,LAKSHADWEEP,2021,29.7,,7.2,2595.0,,,,,,685.0,,
4563,WELL C/O NURSERY SCHOOL,Groundwater,LAKSHADWEEP,2021,30.55,,6.45,860.0,,,,,,559.5,,
4572,WELL C/O OBSERVATORY,Groundwater,LAKSHADWEEP,2021,30.1,,7.45,1043.5,,,,,,678.0,,
1603,"WELL C/O OLD POLICE BARRACKS,",Groundwater,LAKSHADWEEP,2021,30.0,,7.25,1514.5,,,,,,894.5,,
4558,WELL C/O PURAKKATTAPOOMI,Groundwater,LAKSHADWEEP,2021,29.4,,7.4,1037.5,,,,,,674.5,,
1599,WELL C/O PURATHA PALLI,Groundwater,LAKSHADWEEP,2021,28.8,,7.2,621.0,,,,,,416.0,,
1598,WELL C/O PUTHIYA PALLI,Groundwater,LAKSHADWEEP,2021,28.3,,7.3,480.0,,,,,,322.0,,
4560,WELL C/O PUTHIYARA PALLI,Groundwater,LAKSHADWEEP,2021,29.6,,7.0,5220.0,,,,,,3393.0,,
4561,WELL C/O PUTHIYATHAKAL,Groundwater,LAKSHADWEEP,2021,29.6,,6.85,2640.5,,0.3,2.0,2.0,,1750.5,,
4556,WELL C/O SOLAR PLANT,Groundwater,LAKSHADWEEP,2021,29.95,,7.4,868.0,,,,,,581.5,,
4573,WELL C/O SULTHAN VEED,Groundwater,LAKSHADWEEP,2021,29.5,,7.0,950.5,,,,,,618.0,,
4559,WELL C/O THAJ MANZIL,Groundwater,LAKSHADWEEP,2021,29.55,,7.3,1975.0,,,,,,1284.0,,
4567,WELL C/O UJRA PALLI,Groundwater,LAKSHADWEEP,2021,30.0,,7.2,606.0,,,,,,206.0,,
1597,WELL NEAR BADER PALLI,Groundwater,LAKSHADWEEP,2021,27.8,,7.3,563.0,,,,,,377.0,,
1595,WELL NEAR CHEKKILLAM HOUSE,Groundwater,LAKSHADWEEP,2021,28.7,,7.4,373.0,,,,,,250.0,,
1605,WELL NEAR HALIPAD,Groundwater,LAKSHADWEEP,2021,29.9,,7.4,1136.0,,,,,,759.5,,
4571,WELL NEAR HARBOR COTTAGE,Groundwater,LAKSHADWEEP,2021,30.45,,6.9,1913.5,,,,,,1243.5,,
4555,WELL NEAR HELIPAD 2,Groundwater,LAKSHADWEEP,2021,29.7,,7.6,1865.5,,,,,,1249.5,,
1593,WELL NEAR J.B SCHOOL,Groundwater,LAKSHADWEEP,2021,29.0,,7.1,990.0,,,,,,,,
4551,WELL NEAR J.B. SCHOOL (E) WITH MOTOR),Groundwater,LAKSHADWEEP,2021,27.3,,7.2,876.0,,,,,,240.0,,
4548,WELL NEAR KENDRIYA VIDYALAYA,Groundwater,LAKSHADWEEP,2021,29.9,,7.6,1217.5,,,,,,816.0,,
1594,WELL NEAR OTTAVATHIL PALLI,Groundwater,LAKSHADWEEP,2021,27.2,,7.2,935.0,,,,,,626.0,,
1402,WELL NEAR PWD ADJACENT TO CHAKIKILUM IN KAVARATTI,Groundwater,LAKSHADWEEP,2021,28.1,,7.2,663.0,,,,,,444.0,,
4566,WELL NEAR S & T,Groundwater,LAKSHADWEEP,2021,29.2,,6.85,1121.5,,,,,,729.0,,
4549,WELL NEAR STADIUM,Groundwater,LAKSHADWEEP,2021,29.2,,7.4,671.5,,,,,,450.0,,
4557,POND C/O MOHIDHEEN PALLI,Pond/Tank,LAKSHADWEEP,2021,,29.6,,8.15,372.0,,0.32,2.0,2.0,,,
1401,POND NEAR JUMA MASJID,Pond/Tank,LAKSHADWEEP,2021,,29.0,9.0,8.3,600.0,1.0,0.32,5.0,1600.0,,,
4568,POND NEAR KULAPPINAKKAL,Pond/Tank,LAKSHADWEEP,2021,,29.6,,7.0,741.0,,,,,,,
