stn_code,monitoring_location,water_body_type,state,year,safety_label,pollution_score,violated_params,temperature_avg,do_avg,ph_avg,conductivity_avg,bod_avg,nitrate_avg,fecal_coliform_avg,total_coliform_avg,fecal_streptococci_avg
52,"Well, Shri Rao Prajapati Well , M. P.(T/W Of Hanif Khan S/O Jabbar Khan, Amrawati Road, Burhanpur )",Groundwater,MADHYA PRADESH,2019,Unsafe,32.71,"pH Out of Range, High BOD",24.0,,4.5,7.6,500.0,1.0,3.69,2.0,
1616,"Open Well/Tube Well Industrial Area, Govindpura, Bhopal, M.P",Groundwater,MADHYA PRADESH,2019,Unsafe,50.01,High BOD,27.0,,,7.2,366.0,0.8,1.0,,
1617,"Open Well/Tube Well Industrial Area Mandideep, Distt. Raisen, M.P",Groundwater,MADHYA PRADESH,2019,Unsafe,50.02,High BOD,28.0,,,8.0,264.0,0.8,1.5,,
1618,"Ground Water Sampling At Two Points In Industrial Area Malanpur, M.P",Groundwater,MADHYA PRADESH,2019,Unsafe,33.34,High BOD,26.0,,,7.3,500.0,,0.4,2.0,
1619,"Ground Water Sampling At Two Points In Industrial Area Malanpur, M.P",Groundwater,MADHYA PRADESH,2019,Unsafe,33.34,High BOD,26.0,,,7.3,500.0,,0.4,2.0,
1897,"Tube Well At Jainabad, Near Tapti River Bridge, Pumping Stn. Burhanpur, M.P.",Groundwater,MADHYA PRADESH,2019,Unsafe,33.09,"pH Out of Range, High BOD",25.5,,4.4,7.6,500.0,0.9,2.925,2.0,
2144,"Well At Madai Gram, Jabalpur",Groundwater,MADHYA PRADESH,2019,Unsafe,33.34,High BOD,21.2,,,7.15,454.0,0.5,0.72,2.0,
2146,"Well At Bhagatpuri Village, Nagda",Groundwater,MADHYA PRADESH,2019,Unsafe,33.39,High BOD,,,,7.6,500.0,1.0,8.12,2.0,
2147,"Well At Pratal Nagar, Dewas",Groundwater,MADHYA PRADESH,2019,Unsafe,50.01,High BOD,23.0,,,7.9,500.0,2.0,0.82,,
2149,"Well At Culvert On A.B. Road, Maksi",Groundwater,MADHYA PRADESH,2019,Safe,0.13,None,,,,7.6,,2.0,6.69,,
2150,"Well At Trenching Ground, Near Garden, Dev Guradiya Road, Indore",Groundwater,MADHYA PRADESH,2019,Unsafe,30.6,"pH Out of Range, High BOD",26.0,,5.05,7.35,500.0,0.85,3.55,2.0,
2151,"Well At Trenching Ground In The Premises Of M/S Rishabh Masala Udyog, Indore",Groundwater,MADHYA PRADESH,2019,Unsafe,31.56,"pH Out of Range, High BOD",26.0,,4.8,7.65,500.0,1.05,4.59,2.0,
2152,"Well At Trenching Ground In The Premises Of M/S Lakhani Foot Wear, Indore",Groundwater,MADHYA PRADESH,2019,Unsafe,30.98,"pH Out of Range, High BOD",26.0,,4.95,7.5,500.0,0.9,3.81,2.0,
2153,"Well At Ibrahimganj Near Bus Stand, Bhopal",Groundwater,MADHYA PRADESH,2019,Unsafe,100.0,High BOD,27.0,,,7.2,269.0,9.6,,,
2154,"Well At Near Primary School, Pilukhedi, Rajgarh.",Groundwater,MADHYA PRADESH,2019,Unsafe,50.01,High BOD,25.5,,,7.6,500.0,,0.73,,
3332,"Tube Well/ Hand Pump At Industrial Area, Dewas",Groundwater,MADHYA PRADESH,2019,Unsafe,50.07,High BOD,23.5,,,7.7,500.0,1.5,6.515,,
3333,"Hand Pump Water At Banskhedi, Bhopal",Groundwater,MADHYA PRADESH,2019,Unsafe,33.35,High BOD,27.0,,,8.1,500.0,0.7,1.5,2.0,
3334,Tube Well Near Bus Stand At Betul,Groundwater,MADHYA PRADESH,2019,Unsafe,33.34,High BOD,,,,6.9,500.0,1.1,0.46,2.0,
3335,"Tube Well/ Hand Pump At Industrial Area Rechhai, Jabalpur",Groundwater,MADHYA PRADESH,2019,Unsafe,33.34,High BOD,20.25,,,7.95,476.0,0.2,1.0,2.0,
3336,"Tube Well/ Hand Pump At Industrial Area, Chhindwara",Groundwater,MADHYA PRADESH,2019,Unsafe,50.01,High BOD,,,,7.3,500.0,,,3.0,
3337,Tube Well/ Hand Pump At Indl Area Seoni Near Barapatthar,Groundwater,MADHYA PRADESH,2019,Unsafe,33.34,High BOD,24.8,,,7.35,500.0,0.4,1.2,2.0,
3338,"Hand Pump Near Panchayat Bhawan, Village Tinawali Rairu",Groundwater,MADHYA PRADESH,2019,Unsafe,33.34,High BOD,26.0,,,7.6,500.0,,1.2,2.0,
3339,"Tube Well/ Hand Pump Near Manglia Industrial Area , Indore",Groundwater,MADHYA PRADESH,2019,Unsafe,33.09,"pH Out of Range, High BOD",24.0,,4.4,8.0,500.0,0.8,3.14,2.0,
3340,"Tube Well At Near Trenching Ground, Indore",Groundwater,MADHYA PRADESH,2019,Unsafe,31.17,"pH Out of Range, High BOD",24.0,,4.9,7.0,500.0,0.8,3.73,2.0,
3341,"Tube Well At Sector-Iii, Pithampur Industrial Area",Groundwater,MADHYA PRADESH,2019,Unsafe,36.36,"pH Out of Range, High BOD",26.0,,3.55,7.85,500.0,0.95,3.3,2.0,
3342,"Borewell Water At Village Tarpur, Sector-Ii, Pithampur, Industrial Area",Groundwater,MADHYA PRADESH,2019,Unsafe,32.71,"pH Out of Range, High BOD",26.0,,4.5,7.65,500.0,0.85,2.98,2.0,
3343,"Tube Well Near Industrial Area Udyog Vihar , Churat, Rewa",Groundwater,MADHYA PRADESH,2019,Unsafe,32.33,"pH Out of Range, High BOD",28.9,,4.6,6.9,500.0,1.0,3.83,2.0,
3822,"Ground Water Near Bus Stand, Dist Narsingpur",Groundwater,MADHYA PRADESH,2019,Unsafe,33.34,High BOD,22.0,,,7.85,500.0,1.2,1.33,2.0,
3823,"Ground Water Near Bus Stand, Dist Balaghat",Groundwater,MADHYA PRADESH,2019,Unsafe,33.34,High BOD,21.7,,,7.35,500.0,0.3,1.0,2.0,
3825,"Ground Water Near Bus Stand, Dist Mandla",Groundwater,MADHYA PRADESH,2019,Unsafe,33.34,High BOD,25.0,,,7.4,423.0,0.6,1.2,2.0,
3826,"Ground Water Near Bus Stand, Dist Seoni",Groundwater,MADHYA PRADESH,2019,Unsafe,33.34,High BOD,25.0,,,7.3,500.0,0.4,1.2,2.0,
3827,"Ground Water Vill Imalia, Dist Jabalpur",Groundwater,MADHYA PRADESH,2019,Unsafe,33.34,High BOD,25.5,,,7.25,490.0,0.5,1.2,2.0,
3837,"Ground Water Primary School Dhobi Ghat, Dist Singrouli",Groundwater,MADHYA PRADESH,2019,Unsafe,50.02,High BOD,28.0,,,7.55,500.0,,1.56,,
3838,"Ground Water Ncl, Jingurdha, Qshf-176 Metence Off, Dist Singrouli",Groundwater,MADHYA PRADESH,2019,Unsafe,100.0,High BOD,27.75,,,7.65,500.0,,,,
3839,"Ground Water Near Shiv Mandir, Amlori Ncl, Project Singrouli",Groundwater,MADHYA PRADESH,2019,Unsafe,50.0,High BOD,27.5,,,7.55,500.0,,0.11,,
3840,"Ground Water Near Subjee Mandi Ncl Jayant (Beside Police Station), Singrouli",Groundwater,MADHYA PRADESH,2019,Unsafe,50.0,High BOD,27.75,,,7.5,265.0,,0.185,,
3841,"Ground Water Sarveswar Raja Colony Jayant, Singrouli",Groundwater,MADHYA PRADESH,2019,Unsafe,50.03,High BOD,28.25,,,7.55,405.0,,2.625,,
3842,"Ground Water Near Sub Station Sector-B, Dudhichua Ncl Project, Singrouli",Groundwater,MADHYA PRADESH,2019,Unsafe,50.0,High BOD,27.5,,,7.65,415.0,,0.135,,
3843,"Ground Water Near Entrance Gage Of Vivekananad Statue, Nigahi, Singrouli",Groundwater,MADHYA PRADESH,2019,Unsafe,50.0,High BOD,28.25,,,7.55,425.0,,0.16,,
3844,"Ground Water Near Commercial Auto Mobile Near Bharat Petrol Pump, Vindhya Nagar, Singrouli",Groundwater,MADHYA PRADESH,2019,Unsafe,50.02,High BOD,27.5,,,7.65,445.0,,1.58,,
3854,Tube Well Water Sample Of Sidhi City,Groundwater,MADHYA PRADESH,2019,Unsafe,31.55,"pH Out of Range, High BOD",28.5,,4.8,7.1,500.0,0.9,1.31,2.0,
4618,"Ground Water At Industrial Area, Maneri Distt Mandla",Groundwater,MADHYA PRADESH,2019,Unsafe,100.0,High BOD,,,,7.2,338.0,,,,
1373,"Upper Lake At Bhopal (Intake Point), M.P.",River,MADHYA PRADESH,2019,Unsafe,20.02,High BOD,,24.5,7.8,7.95,295.5,1.95,4.295,2.0,175.0
1374,Lower Lake At Bhopal Outlet M.P.,River,MADHYA PRADESH,2019,Unsafe,20.17,High BOD,,24.0,7.15,8.0,368.0,6.6,10.99,155.0,1260.0
1466,"Multai Tank Lake At Villa. Khari On Betul-Amravati Road M.P(.River Tapti Near Amarawati, Road Bridge At Village Kheda)",River,MADHYA PRADESH,2019,Unsafe,20.01,High BOD,,27.0,8.25,7.75,316.0,1.35,1.145,2.0,875.0
2128,Khandari Reservoir Water Off Take Point,River,MADHYA PRADESH,2019,Unsafe,20.01,High BOD,,23.55,7.85,7.7,326.0,1.45,0.77,7.0,40.0
2130,"Madhav Lake, Shivpuri",River,MADHYA PRADESH,2019,Unsafe,20.31,"pH Out of Range, High BOD",,24.0,6.4,7.9,500.0,2.35,0.91,4.0,79.0
2131,Yashwant Sagar At Indore,River,MADHYA PRADESH,2019,Unsafe,20.01,High BOD,,22.5,6.95,8.0,500.0,1.55,1.285,2.0,69.5
2132,Bilawali Talab At Indore,River,MADHYA PRADESH,2019,Unsafe,20.01,High BOD,,22.5,7.15,8.3,409.0,1.85,2.195,2.0,114.0
2133,Sirpur Talab At Indore,River,MADHYA PRADESH,2019,Unsafe,20.01,High BOD,,22.5,6.7,8.1,500.0,1.85,1.08,2.0,79.5
2134,Nagchun Talab At Khandwa,River,MADHYA PRADESH,2019,Unsafe,20.0,High BOD,,23.0,7.0,7.95,335.0,1.2,0.585,2.0,38.5
2135,Govindgarh Lake,River,MADHYA PRADESH,2019,Unsafe,20.0,High BOD,,26.25,6.8,7.45,334.5,1.2,0.265,2.0,47.0
2136,"Shahpura Lake At Weir Near Ayushman Hospital, Bhopal",River,MADHYA PRADESH,2019,Unsafe,20.17,High BOD,,23.0,7.25,8.1,413.0,7.85,18.765,121.0,1335.0
2137,Upper Lake At Yatch Club,River,MADHYA PRADESH,2019,Unsafe,20.02,High BOD,,25.0,7.75,8.15,279.0,2.5,5.105,2.0,175.0
2138,Upper Lake At Karbala Club,River,MADHYA PRADESH,2019,Unsafe,20.02,High BOD,,25.0,7.9,8.05,280.5,2.35,4.08,2.0,170.0
2139,Upper Lake At Bairagarh Club,River,MADHYA PRADESH,2019,Unsafe,20.02,High BOD,,25.5,7.9,8.05,271.0,2.1,5.675,2.0,190.0
2140,"Kerwa Dam Near Rest House, Bpl",River,MADHYA PRADESH,2019,Unsafe,20.01,High BOD,,23.0,7.65,7.9,266.5,2.3,2.125,2.0,58.0
2141,Janunia Talab Near W/S,River,MADHYA PRADESH,2019,Unsafe,20.01,High BOD,,23.5,8.25,7.9,500.0,2.05,1.86,2.0,140.0
2142,"Kalisindh Reservoir At Sarangpur, Rajgarh",River,MADHYA PRADESH,2019,Unsafe,20.77,"pH Out of Range, High BOD",,20.0,6.25,8.45,407.5,1.75,0.43,2.0,48.0
3296,Choral Dam Near Indore,River,MADHYA PRADESH,2019,Unsafe,20.01,High BOD,,23.0,7.5,8.0,480.5,1.4,1.85,2.0,51.0
3845,Kanhargaon Stop Dam Water Supply Intake Of Chhindwara Town,River,MADHYA PRADESH,2019,Unsafe,27.32,"pH Out of Range, High BOD",,,5.9,7.6,500.0,2.3,2.5,3.0,19.5
4614,Suptal Jabalpur,River,MADHYA PRADESH,2019,Unsafe,20.02,High BOD,,23.5,7.1,7.65,457.5,3.2,1.015,20.5,540.0
4615,Ganga Sagar Jabalpur,River,MADHYA PRADESH,2019,Unsafe,20.03,High BOD,,25.05,6.95,7.8,496.0,3.6,1.45,25.0,540.0
4622,Koptal Lake At Water Supply Intake Point Chhatarpur,River,MADHYA PRADESH,2019,Unsafe,20.0,High BOD,,25.0,7.0,7.85,293.0,1.05,0.23,2.0,13.0
3297,"Mitha Talab, Dewas",Pond/Tank,MADHYA PRADESH,2019,Unsafe,20.02,High BOD,,24.0,6.95,7.8,500.0,1.1,0.58,19.0,58.0
3298,Pond Water At Lakoda,Pond/Tank,MADHYA PRADESH,2019,Unsafe,20.0,High BOD,,22.0,7.25,7.55,253.0,2.0,0.385,4.0,44.0
3299,Hanumantal Jabalpur,Pond/Tank,MADHYA PRADESH,2019,Unsafe,20.1,High BOD,,23.55,6.75,7.75,500.0,4.3,1.1,121.0,1100.0
3300,"Ranital Talab, Jabalpur",Pond/Tank,MADHYA PRADESH,2019,Unsafe,20.61,"pH Out of Range, High BOD",,25.25,6.35,7.7,500.0,7.55,1.96,176.0,1600.0
3301,Moti Talab At Balaghat,Pond/Tank,MADHYA PRADESH,2019,Unsafe,20.05,High BOD,,24.9,7.05,7.55,500.0,3.1,1.125,61.0,540.0
3302,"Pipliya Pala Talab, Indore",Pond/Tank,MADHYA PRADESH,2019,Unsafe,20.16,"pH Out of Range, High BOD",,22.5,6.45,7.75,500.0,2.6,2.145,2.0,127.0
3303,"Rani Talab, Rewa",Pond/Tank,MADHYA PRADESH,2019,Unsafe,20.0,High BOD,,28.0,6.6,7.75,315.5,1.25,0.35,3.0,29.5
3304,"Rihand Resrvoir, Singrauli",Pond/Tank,MADHYA PRADESH,2019,Unsafe,20.0,High BOD,,30.0,6.9,7.4,355.0,1.8,0.4,2.0,16.0
3830,"Gokalpur Talab, Dist Jabalpur",Pond/Tank,MADHYA PRADESH,2019,Unsafe,20.06,High BOD,,21.85,7.2,7.8,500.0,4.7,1.0,71.0,430.0
3831,"Dal Sagar Talab, Dist Seoni",Pond/Tank,MADHYA PRADESH,2019,Unsafe,20.04,High BOD,,24.9,6.95,7.7,401.0,3.5,0.97,43.0,430.0
3849,Sitapat Talab Dhar,Pond/Tank,MADHYA PRADESH,2019,Unsafe,21.39,"pH Out of Range, High BOD",,23.5,6.05,7.9,415.0,1.3,0.58,2.0,46.0
3850,Bagdoon Talab Pithampur Sanjay Jalashay Pithampur,Pond/Tank,MADHYA PRADESH,2019,Unsafe,20.01,High BOD,,23.0,7.25,8.2,457.0,1.45,1.5,2.0,51.5
2129,Periat Tank Near Wss Intake Point Jabalpur,Pond/Tank,MADHYA PRADESH,2019,Unsafe,20.01,High BOD,,23.0,7.65,7.75,500.0,1.65,0.97,6.0,41.0
4620,"Ajab Bourali Dam Petlavad, Jhabua",River,MADHYA PRADESH,2019,Safe,2.6,None,23.5,7.0,8.2,334.0,1.15,0.66,2.0,44.0,
4619,Dejla Dewda Khargon,River,MADHYA PRADESH,2019,Safe,2.51,None,22.0,6.5,8.0,445.5,1.1,1.08,2.0,76.0,
4611,River Gambhir At Dam Site Ujjain,River,MADHYA PRADESH,2019,Safe,4.28,None,28.0,7.1,7.55,389.0,1.9,0.755,4.0,55.0,
4613,"Hiran River After Mixing Pariyat River Near Road Bridge At Vill Ganiyari, Jabalpur",River,MADHYA PRADESH,2019,Unsafe,8.95,High BOD,20.15,7.0,7.85,1795.0,3.8,0.97,71.0,289.5,
4624,Katni River D/S Near Mohanghat Katni,River,MADHYA PRADESH,2019,Safe,4.31,None,26.05,6.05,7.7,496.0,1.9,0.825,10.0,64.0,
4606,River Ken Near Road Bridge At Panna Chhatarpur,River,MADHYA PRADESH,2019,Safe,1.91,None,26.5,6.95,7.85,227.5,0.85,0.225,2.0,14.0,
4621,Nanpur Fata Dam Alirajpur,River,MADHYA PRADESH,2019,Safe,2.15,None,24.5,6.7,8.25,410.5,0.95,0.86,2.0,41.0,
4612,Sitaram Jaju Sagar Dam/Pond Water At Harkhiya Khal Neemuch,River,MADHYA PRADESH,2019,Safe,4.83,None,30.0,6.75,7.6,395.5,2.1,1.065,17.0,129.0,
4609,"River Tons At M.P-U.P Boundary, Before Mixing River Belan Chakghat Rewa",River,MADHYA PRADESH,2019,Safe,2.4,None,29.75,6.9,7.65,404.0,1.05,0.55,10.0,36.0,
1614,"Betwa Near Intake Point, Vidisha, M.P",River,MADHYA PRADESH,2019,Unsafe,25.95,High Total Coliform,23.5,8.7,8.05,1917.0,1.85,3.3,461.0,47270.0,
2107,"River Betwa At U/S At Mahuta Ghat, Agasod",River,MADHYA PRADESH,2019,Safe,2.8,None,25.5,6.95,7.85,307.5,1.0,,,22.0,
2108,"River Betwa At M/S J.P. Thermal Power, Bina",River,MADHYA PRADESH,2019,Safe,2.8,None,25.5,7.0,7.85,310.0,1.0,0.1,,20.5,
2119,"Betwa At Nayapur D/S Mandideep Indl. Area No.1, Dist.Raisen",River,MADHYA PRADESH,2019,Safe,6.23,None,24.5,8.2,7.95,463.5,2.35,2.4,2.0,1260.0,
2121,"Betwa Near Road Bridge, Bhojpur",River,MADHYA PRADESH,2019,Safe,5.97,None,23.0,8.05,7.8,628.5,2.35,3.65,14.0,875.0,
2122,Betwa Near W/S Intake Well Point Raisen,River,MADHYA PRADESH,2019,Unsafe,25.0,High Total Coliform,24.0,7.45,7.95,347.0,2.25,2.3,2.0,27175.0,
2124,"Betwa At Charantirghat, Vidisha",River,MADHYA PRADESH,2019,Unsafe,33.89,"High BOD, High Fecal Coliform, High Total Coliform",23.5,7.9,8.05,363.5,4.05,3.65,1224.0,80175.0,
2125,Betwa D/S After Mixing Of River Bais At Vidisha,River,MADHYA PRADESH,2019,Unsafe,35.9,"High BOD, High Fecal Coliform, High Total Coliform",21.0,8.2,7.85,453.0,4.8,7.1,1310.0,160000.0,
3832,Betwa At U/S Near Road Bridge Orchha,River,MADHYA PRADESH,2019,Safe,2.23,None,28.0,7.1,7.7,1287.5,0.8,0.25,,12.5,
30080,"Betwa At Kanjia Road Bridge, Ashok Nagar (M.P.)",River,MADHYA PRADESH,2019,Safe,2.45,None,25.3,8.2,7.2,616.0,1.1,0.9,2.0,2.0,
3833,"Betwa At Rajghat Dam, Sagar",River,MADHYA PRADESH,2019,Safe,2.54,None,25.5,6.8,7.75,337.0,0.9,0.3,,47.5,
3309,"Chambal At Tal Village Near Bridge, Ujjain",River,MADHYA PRADESH,2019,Unsafe,10.96,"High BOD, High Total Coliform",24.5,6.8,7.8,756.5,3.9,0.8,24.0,2760.0,
1365,Chambal At Nagda U/S (Water Intake Point) M.P.,River,MADHYA PRADESH,2019,Safe,4.74,None,25.5,7.05,7.7,523.0,2.1,0.9,7.5,65.0,
1366,"Chambal At Nagda D/S, M.P.",River,MADHYA PRADESH,2019,Unsafe,66.6,"Low DO, High BOD, High Fecal Coliform, High Total Coliform",26.0,3.35,7.65,5730.0,37.5,4.85,27023.0,80175.0,31.0
1432,"Parvati Near Village Bataodapar, M.P.",River,MADHYA PRADESH,2019,Safe,5.94,None,21.5,7.35,7.9,899.5,2.65,0.85,3.0,58.5,
2109,"Parvati River, Guna",River,MADHYA PRADESH,2019,Safe,4.68,None,20.5,7.65,7.8,915.0,2.05,0.75,20.0,55.5,
2126,"Parvati A/C Of Vindhyachal Nalla, Pilukhedi",River,MADHYA PRADESH,2019,Safe,5.41,None,21.0,6.6,7.7,914.5,2.4,0.85,5.0,75.0,
1367,Khan At Kabit Khedi (Near Indore) M.P.,River,MADHYA PRADESH,2019,Unsafe,41.0,"Low DO, High BOD, High Fecal Coliform, High Total Coliform",23.0,3.5,7.65,1000.0,24.0,10.4,2775.0,4870.0,435.0
2110,"Khan At Sakkar Khadi, Indore",River,MADHYA PRADESH,2019,Unsafe,27.9,"Low DO, High BOD, High Fecal Coliform, High Total Coliform",23.0,4.4,7.55,1179.5,26.5,6.5,760.0,3075.0,330.0
2111,Khan At Sanwer,River,MADHYA PRADESH,2019,Unsafe,22.7,High BOD,23.5,6.1,8.05,1035.5,19.2,5.45,460.5,1070.0,124.5
1369,"Kshipra At Ramghat At Ujjain, M.P.",River,MADHYA PRADESH,2019,Unsafe,57.76,"High BOD, High Fecal Coliform, High Total Coliform",28.5,7.15,7.8,1183.0,8.0,1.65,7555.0,80460.0,
1370,"Kshipra At Trivenisangam (1 Km. D/S Of Sangam), M.P.",River,MADHYA PRADESH,2019,Unsafe,50.43,"High BOD, High Fecal Coliform, High Total Coliform",28.5,7.0,8.05,746.0,4.7,1.75,6008.5,80215.0,
1468,"Kshipra At Siddhawat (D/S) Of Ujjain., M.P.",River,MADHYA PRADESH,2019,Unsafe,60.0,"High BOD, High Fecal Coliform, High Total Coliform",28.5,6.5,7.85,1110.5,11.5,2.2,46110.0,80800.0,23.0
3315,"Kshipra At Gaughat, Ujjain",River,MADHYA PRADESH,2019,Unsafe,53.1,"High BOD, High Fecal Coliform, High Total Coliform",28.5,7.0,7.65,788.0,5.9,1.7,7005.5,80060.0,
3316,"Kshipra At U/S Of Mahidpur City, Ujjain",River,MADHYA PRADESH,2019,Unsafe,14.18,High Total Coliform,24.0,7.0,7.8,677.0,3.0,1.1,271.0,8047.0,
3317,"Kshipra At W/S Intake Point Of Dewas, Ujjain",River,MADHYA PRADESH,2019,Safe,4.52,None,23.0,7.2,7.6,319.5,1.95,0.6,34.5,64.0,
2117,"Bichia, Bridge Govindgarh Road",River,MADHYA PRADESH,2019,Safe,6.42,None,27.75,5.85,7.65,417.0,2.8,0.5,31.5,93.5,
1433,"Sankh At Tigra Reservoir, M.P.",River,MADHYA PRADESH,2019,Safe,4.15,None,20.5,7.5,7.9,776.5,1.85,0.8,3.0,43.0,
1610,"Sone At Origin Amarkantak, M.P",River,MADHYA PRADESH,2019,Safe,2.64,None,24.6,7.05,7.55,204.5,0.95,0.35,,1.9,
1142,"Sone At Chachai, M.P.",River,MADHYA PRADESH,2019,Unsafe,9.81,High BOD,26.75,7.35,7.85,1778.0,4.4,0.6,2.0,45.0,
1371,"Sone At Amlai, M.P.",River,MADHYA PRADESH,2019,Safe,3.94,None,26.7,7.4,7.75,537.5,1.4,0.7,,51.5,
1612,"Sone At Devload Out Let Of Bansagar Dam, M.P",River,MADHYA PRADESH,2019,Unsafe,6.6,Low DO,26.25,4.3,7.8,434.5,1.1,0.45,,45.0,
3327,"Sone At Amlai, 100 Metre D/S After Mixing Of Atps Effluent, Rewa",River,MADHYA PRADESH,2019,Safe,4.49,None,26.9,7.25,7.9,1940.0,1.6,0.8,,54.0,
3834,"Sone At Chitawal Near Road Bridge Chitrangi, Dist Singrouli",River,MADHYA PRADESH,2019,Safe,4.87,None,26.1,7.05,7.5,212.5,1.75,1.4,,14.0,
3836,"Sone On Kachan Dam Near Imilya North Coal Mines Vill Majhouli, Dist Singrouli",River,MADHYA PRADESH,2019,Safe,5.15,None,27.1,6.95,7.6,335.0,1.85,0.5,,15.0,
3846,"Sone At Jarwahi Near Road Bridge, Shahdol",River,MADHYA PRADESH,2019,Safe,3.37,None,26.9,7.45,6.65,544.0,1.2,0.55,,45.0,
30082,Sone Deora U/S Rihand (M. P.),River,MADHYA PRADESH,2019,Unsafe,35.37,"High Fecal Coliform, High Total Coliform",21.2,7.8,7.6,215.0,1.7,0.5,4500.0,17000.0,
3851,"Sone Near Bhanvarsen Road Bridge After Confluence Of Banas River, Dist Sidhi",River,MADHYA PRADESH,2019,Safe,2.48,None,28.0,7.0,7.5,470.0,1.1,0.2,2.0,36.0,
3835,"Gopad At Nigari, Sarai Dist, Singrouli",River,MADHYA PRADESH,2019,Safe,4.32,None,26.1,6.8,7.35,205.0,1.55,1.4,,16.0,
1607,"Gohad Dam, Gohad, M.P",River,MADHYA PRADESH,2019,Safe,5.24,None,27.5,5.9,7.95,869.5,2.3,0.6,5.0,140.0,
3313,"Kariyari U/S Before Mixing With Waste Water Of M/S J.P. Cement , Rewa",River,MADHYA PRADESH,2019,Safe,3.59,None,24.55,6.7,7.4,440.0,1.6,0.35,3.0,30.0,
3314,"Kariyari 100 Mtr. D/S After Mixing With Waste Water Of M/S J.P. Cement, Rewa",River,MADHYA PRADESH,2019,Safe,3.04,None,24.45,6.35,7.5,466.0,1.35,0.3,3.0,42.5,
3319,"Newaj At W/S Intake Point, Shujalpur, Ujjain",River,MADHYA PRADESH,2019,Safe,6.28,None,22.5,6.95,7.55,3629.5,2.75,0.9,19.0,125.0,
3320,"Newaj At U/S Near W/S Intake Point, Rajgarh, Guna",River,MADHYA PRADESH,2019,Safe,3.59,None,22.5,7.3,7.9,701.0,1.6,0.8,2.0,34.5,
3310,"Chamla At W/S Intake Point Badnagar, Ujjain",River,MADHYA PRADESH,2019,Safe,5.95,None,24.0,7.35,7.75,501.0,2.6,0.55,17.5,134.0,
3306,"Choupan At Vijaypur U/S Nfl Nalla, Guna",River,MADHYA PRADESH,2019,Safe,3.92,None,21.0,7.15,7.8,340.0,1.75,0.65,2.0,36.0,
3307,"Choupan At Vijaypur 100 Metre D/S Of Nfl Nalla, Guna",River,MADHYA PRADESH,2019,Safe,4.6,None,19.1,6.45,8.25,526.5,2.05,0.75,3.0,45.5,
2100,"Gour River Bhoga Door, Jabalpur",River,MADHYA PRADESH,2019,Safe,3.61,None,23.55,7.45,7.8,1820.0,1.6,0.9,6.9,43.5,
3311,"Jamuni At Bariyaghat U/S Near Intake Point, Tikamgarh",River,MADHYA PRADESH,2019,Safe,2.37,None,28.5,6.95,7.95,308.5,0.85,0.35,,13.5,
1233,"Mahi At Badnawar, M.P.",River,MADHYA PRADESH,2019,Safe,2.81,None,23.0,7.3,8.2,29569.0,1.25,0.9,1.8,35.5,
3318,"Mahi At Ranisingh Village, Ratlam, Ujjain",River,MADHYA PRADESH,2019,Safe,4.69,None,25.5,7.25,7.65,415.0,2.05,1.7,9.5,130.0,
3848,Anas River Near Road Bridge Jhabua,River,MADHYA PRADESH,2019,Safe,3.16,None,23.0,7.4,8.25,432.0,1.4,0.85,1.8,52.0,
2104,Malei At Jaora,River,MADHYA PRADESH,2019,Safe,6.63,None,25.5,6.9,7.55,630.5,2.85,1.2,36.0,199.5,4.0
2102,"Shivna At Ramghat, Mandsaur",River,MADHYA PRADESH,2019,Safe,5.28,None,26.5,7.05,7.6,480.0,2.3,1.0,16.5,129.0,
3321,"Narmada At Amarkantak From Origin Point, Rewa River Narmada At Dindori,U/S Intake Point,Distt.Dindori(M.P.)",River,MADHYA PRADESH,2019,Safe,3.5,None,26.0,7.7,7.8,1776.0,1.25,0.8,,36.0,
1242,Narmada Near Source At Amarkantak M.P.,River,MADHYA PRADESH,2019,Safe,1.02,None,24.95,7.35,7.65,1207.0,0.45,0.35,1.8,18.9,
1241,Narmada At Mandla Near Road Bdg. M.P.,River,MADHYA PRADESH,2019,Safe,3.5,None,20.4,7.4,7.8,284.0,1.55,0.85,5.9,43.0,
1240,Narmada At Narsinghpur,River,MADHYA PRADESH,2019,Safe,3.62,None,18.6,7.45,7.75,1280.0,1.6,0.95,7.4,47.5,
2106,Narmada At Nemawar,River,MADHYA PRADESH,2019,Safe,4.08,None,23.0,6.85,7.85,244.5,1.8,0.45,9.9,51.5,
45,Narmada At Mandleshwar,River,MADHYA PRADESH,2019,Safe,2.48,None,22.5,7.65,8.2,246.5,1.1,0.445,1.8,42.0,
1239,"Narmada At Badwani,",River,MADHYA PRADESH,2019,Safe,2.92,None,22.5,7.5,8.2,352.5,1.3,0.85,1.8,39.5,
1431,"Narmada At Maheshwar,",River,MADHYA PRADESH,2019,Safe,2.7,None,23.0,7.75,8.15,313.5,1.2,0.65,1.8,40.5,
2099,"Narmada Lalpur, Jabalpur",River,MADHYA PRADESH,2019,Safe,3.28,None,20.25,7.7,7.8,259.0,1.45,0.8,6.4,43.0,
1234,Narmada At Hoshangabad U S M.P.,River,MADHYA PRADESH,2019,Safe,3.96,None,25.0,8.4,8.0,933.5,1.65,2.3,10.0,317.0,
2112,"Narmada Near Mortakka Bridge, Badwah",River,MADHYA PRADESH,2019,Safe,2.26,None,23.0,7.45,8.3,309.5,1.0,0.7,1.8,44.0,
44,Narmada At Sethanighat,River,MADHYA PRADESH,2019,Safe,5.86,None,24.5,8.0,8.0,1025.0,2.15,2.715,25.5,1235.0,
1235,Narmada At Hoshangabad D S M.P.,River,MADHYA PRADESH,2019,Safe,5.88,None,25.0,8.65,8.0,332.0,2.15,8.0,56.0,1105.0,
2113,"Narmada Near Punasa Dam, Punasa",River,MADHYA PRADESH,2019,Safe,2.51,None,22.5,7.1,8.25,298.5,1.1,0.95,9.9,41.5,
1430,Narmada At D S Of Omkareshwar M.P.,River,MADHYA PRADESH,2019,Safe,2.71,None,22.5,7.35,8.2,343.0,1.2,0.75,1.8,43.5,
3322,"Narmada At Mandla, Near Shamshanghat, Jabalpur",River,MADHYA PRADESH,2019,Safe,4.03,None,20.15,7.6,7.75,281.0,1.45,0.8,1.8,,
3323,"Narmada At Lalpur, Near Water Supply Intake Point, Jabalpur",River,MADHYA PRADESH,2019,Safe,3.37,None,20.05,7.15,7.95,1545.0,1.5,0.7,3.9,25.0,
3324,"Narmada At Panchwatighat, Before Mixing With Bawanganga River, Jabalpur",River,MADHYA PRADESH,2019,Safe,3.6,None,18.6,7.5,7.75,302.5,1.6,0.7,5.4,39.0,
3325,"Narmada At Sarswatighat, After Mixing With Bawanganga River, Jabalpur",River,MADHYA PRADESH,2019,Safe,3.62,None,18.7,7.5,7.7,325.0,1.6,0.9,7.9,45.0,
2118,Narmada River At D/S Of Kapildhara,River,MADHYA PRADESH,2019,Safe,3.59,None,25.5,7.5,7.75,404.0,1.6,0.6,1.8,44.0,
2123,Narmada At Korighat Hoshangabad,River,MADHYA PRADESH,2019,Safe,4.88,None,24.5,8.5,8.2,255.0,1.75,2.25,32.4,1081.5,
3326,"Simrar At Katni Near Acc W/S Intake Point, Jabalpur",River,MADHYA PRADESH,2019,Safe,3.62,None,25.6,5.7,7.85,399.0,1.6,1.1,9.9,39.0,
3828,"Hiran, Nh 7 Road Bridge, Sihora, Dist Jabalpur",River,MADHYA PRADESH,2019,Safe,3.95,None,18.95,7.4,7.75,353.0,1.75,0.95,6.4,45.5,
3829,"Hiran, Nh -12 Road Bridge Vil Vikrampur ,Dist Narsingpur",River,MADHYA PRADESH,2019,Safe,4.5,None,19.05,7.0,7.65,2252.0,2.0,0.9,6.4,41.0,
3847,Narmada River At Dharampuri,River,MADHYA PRADESH,2019,Safe,2.26,None,23.5,7.1,8.1,337.5,1.0,0.8,1.8,41.0,
1236,"Chota Tawa Before Confl. With River Narmada, M.P.",River,MADHYA PRADESH,2019,Safe,2.26,None,21.0,7.05,8.0,471.0,1.0,0.7,1.8,45.5,
2100,"Gour River Bhoga Door, Jabalpur",River,MADHYA PRADESH,2019,Safe,3.61,None,23.55,7.45,7.8,1820.0,1.6,0.9,6.9,43.5,
2114,Kunda At Khargone,River,MADHYA PRADESH,2019,Safe,4.05,None,21.5,6.7,7.9,574.5,1.6,2.15,65.9,291.5,
2115,Tapi At Nepa Nagar 100 Metre D/S After Mixing Pandhar Nalla,River,MADHYA PRADESH,2019,Safe,3.78,None,23.0,7.0,8.35,429.0,1.55,1.4,47.9,178.5,5.0
9,Tapi At Nepanagar,River,MADHYA PRADESH,2019,Safe,2.47,None,23.0,6.9,7.85,373.0,1.1,1.093,1.8,28.0,
10,Tapi At Burhanpur,River,MADHYA PRADESH,2019,Unsafe,8.91,High BOD,23.5,5.95,7.95,669.0,3.65,4.4695,140.9,299.0,
1250,Tapi At Hatnur M.P.,River,MADHYA PRADESH,2019,Safe,4.54,None,23.5,5.9,8.2,729.5,2.0,4.35,1.8,120.0,
2127,"Denwa Near Sarni, Road Bridge",River,MADHYA PRADESH,2019,Safe,3.5,None,25.0,8.55,8.0,442.0,1.55,1.67,2.0,58.5,
1213,"Wainganga At Balaghat,",River,MADHYA PRADESH,2019,Safe,4.31,None,16.65,7.5,7.75,2200.0,1.55,0.75,1.8,,
1214,"Wainganga At Chindwara,",River,MADHYA PRADESH,2019,Safe,5.13,None,,7.2,7.8,800.0,2.3,2.5,3.5,17.5,
3330,"Wainganga At Chhapara, Near W/S Intake Point, Jabalpur",River,MADHYA PRADESH,2019,Safe,3.39,None,23.1,7.45,7.75,329.0,1.5,0.7,5.9,41.0,
3312,"Kanhan At Chindwara Before Mixing Boregaon Growth Centre Nalla, Jabalpur",River,MADHYA PRADESH,2019,Safe,5.13,None,,7.3,7.5,690.5,2.3,1.4,3.0,18.5,
