stn_code,monitoring_location,water_body_type,state,year,temperature_avg,do_avg,ph_avg,conductivity_avg,bod_avg,nitrate_avg,fecal_coliform_avg,total_coliform_avg,fecal_streptococci_avg,total_dissolved_solids_avg,fluoride_avg,arsenic_avg
2470,"AT INDUSTRIAL AREA, FATEHPUR",Groundwater,UTTAR PRADESH,2021,25.45,,7.15,1951.5,1.0,1.1,2.0,2.0,,197.5,0.35,
2469,"AT INDUSTRIAL AREA. NAINI, ALLAHABAD",Groundwater,UTTAR PRADESH,2021,25.35,,7.25,1207.5,1.0,0.875,2.0,2.0,,257.0,0.4,
2468,"BHADOHI INDUSTRIAL AREA, DEVELOPMENT AUTHORITY, SANT RAVIDAS NAGAR",Groundwater,UTTAR PRADESH,2021,25.0,,7.75,516.0,,,,,,306.5,,
2467,"CHANDPUR INDUSTRIAL AREA, LAHARTARA, VARANASI",Groundwater,UTTAR PRADESH,2021,24.5,,7.8,549.0,,,,,,319.0,,
1756,"GOPIGANJ INDUSTRIAL AREA BHADOHI, VARANASI, U.P",Groundwater,UTTAR PRADESH,2021,25.25,,7.75,489.0,,,,,,291.0,,
1758,"GROUND AROUND STP DINAPUR, VARANASI, U.P",Groundwater,UTTAR PRADESH,2021,24.75,,7.65,488.0,,,,,,267.0,,
1754,"HAPUR ROAD INDUSTRIAL AREA GHAZIABAD, U.P",Groundwater,UTTAR PRADESH,2021,21.5,,7.3,710.0,1.0,0.305,2.0,2.0,,357.5,0.2,
1759,"IFFCO, PHOOLPUR, ALLAHABAD, U.P",Groundwater,UTTAR PRADESH,2021,25.3,,7.15,1140.0,1.0,0.895,2.0,2.0,,238.5,0.4,
1747,"INDIA MARKA HAND PUMP IN SAROWNI BLOCK AT RAIBAREILLY, U.P",Groundwater,UTTAR PRADESH,2021,17.5,,8.15,934.0,,,2.0,2.0,,585.0,1.2,
2475,"INDUSTRIAL AREA, SULTANPUR ROAD",Groundwater,UTTAR PRADESH,2021,18.0,,8.0,919.5,,,2.0,2.0,,715.0,0.7,
1760,"M/S KANORIA CHEMICAL SONBHADRA, U.P",Groundwater,UTTAR PRADESH,2021,,,8.0,2600.0,,,,,,1306.0,,
1753,"MEERUT ROAD INDUSTRIAL AREA GHAZIABAD, U.P",Groundwater,UTTAR PRADESH,2021,22.0,,7.35,849.0,1.0,0.3,2.0,2.0,,537.5,0.2,
1757,"MIRZAPUR INDUSTRIAL AREA, U.P",Groundwater,UTTAR PRADESH,2021,,,7.3,694.0,,,,346.0,,345.0,,
1746,"NAGAR PALIKA TUBE WELL, SULTANPUR, U.P",Groundwater,UTTAR PRADESH,2021,17.5,,8.0,776.0,,,2.0,2.0,,508.0,0.65,
2477,NEAR ARYA KANYA INTER COLLEGE. JALAUN,Groundwater,UTTAR PRADESH,2021,23.0,,7.5,948.0,,,,,,568.0,,
2481,"NEAR PEER BEGRAJ INDSTRIAL AREA, MUZAFFARNAGAR",Groundwater,UTTAR PRADESH,2021,21.5,,7.5,462.5,,,,,,348.5,,
1755,"PILKHUA INDUSTRIAL AREA GHAZIABAD, U.P",Groundwater,UTTAR PRADESH,2021,21.5,,7.2,1380.0,1.0,0.3,2.0,2.0,,836.0,0.2,
1752,"SAHIBABAD INDUSTRIAL AREA, GHAZIABAD, U.P",Groundwater,UTTAR PRADESH,2021,22.5,,7.1,2086.0,1.1,0.35,2.0,2.0,,1192.0,0.2,
1751,"TUBE WELL IN INDUSTRIAL AREA AT GAJRAULA, MORADABAD, U.P",Groundwater,UTTAR PRADESH,2021,,,7.4,742.0,1.0,0.3,2.0,24.0,,464.0,0.4,
1761,"TUBE WELL IN SINGRAULI INDUSTRIAL AREA, U.P",Groundwater,UTTAR PRADESH,2021,,,7.4,186.0,,,,,,94.0,,
2474,UNCHAHAAR (NEAR THERMAL POWER PLANT),Groundwater,UTTAR PRADESH,2021,19.0,,7.85,861.0,,,2.0,2.0,,582.0,0.75,
1364,"RAMGARH LAKE, U.P.",Pond/Tank,UTTAR PRADESH,2021,,20.5,8.3,8.55,503.5,6.0,,35000.0,59500.0,,,
2499,"SAMARPUR JHEEL, RAEBARELI",Pond/Tank,UTTAR PRADESH,2021,,22.5,6.4,7.9,311.0,4.5,0.86,3950.0,7100.0,,,
2501,"LAXMI POND, JHANSI",Pond/Tank,UTTAR PRADESH,2021,,20.0,5.15,7.8,626.5,10.5,,,,,,
2500,"MAAHIL POND, URAI TEHSIL, JALAUN",Pond/Tank,UTTAR PRADESH,2021,,20.6,2.95,8.2,1263.0,24.0,,4300.0,6300.0,,,
3050,WATER WORKS- GHAZIABAD,Drain/STP/WTP,UTTAR PRADESH,2021,13.5,6.5,7.2,727.5,,,135.0,1950.0,,,,
30006,RIVER GANGA AT BIJNOR (U.P.),River,UTTAR PRADESH,2021,19.5,8.8,6.85,196.0,1.6,0.42,85100.0,1700.0,176.5,,,
10150,"RIVER GANGA AT MADHYA GANGA BARRAGE, BIJNOR",River,UTTAR PRADESH,2021,,9.25,7.95,10905.5,1.25,,785.0,1170.0,2.0,,,
1062,"RIVER GANGA AT GARHMUKTESHWAR, U.P",River,UTTAR PRADESH,2021,23.5,8.8,7.5,330.5,2.05,0.35,461.0,801.0,141.0,,,
10149,RIVER GANGA AT GHARMUKTESHWAR,River,UTTAR PRADESH,2021,23.5,9.3,7.3,288.0,1.5,3.95,230.0,565.0,95.0,,,
2488,"RIVER GANGA U/S, ANOOPSHAHAR",River,UTTAR PRADESH,2021,25.0,7.85,7.1,146.0,1.95,,655.0,1265.0,,,,
2489,"RIVER GANGA D/S, ANOOPSHAHAR",River,UTTAR PRADESH,2021,25.0,8.45,7.2,146.0,1.35,,715.0,1515.0,430.0,,,
1145,RIVER GANGA AT NARORA (BULANDSAHAR),River,UTTAR PRADESH,2021,24.5,7.7,7.3,153.0,2.0,,810.0,1800.0,,,,
2490,"RIVER GANGA AT KACHHLA GHAT, ALIGARH",River,UTTAR PRADESH,2021,24.0,8.6,7.55,139.0,1.2,,245.0,405.0,2.0,,,
10151,RIVER GANGA AT FARRUKABAD,River,UTTAR PRADESH,2021,21.5,9.15,8.25,307.0,2.9,,3325.0,8800.0,301.0,,,
1063,"RIVER GANGA AT KANNAUJ U/S (RAJGHAT), U.P",River,UTTAR PRADESH,2021,24.25,8.25,8.25,279.5,2.85,,1400.0,3050.0,1951.0,,,
1066,"RIVER GANGA AT KANNAUJ D/S, U.P",River,UTTAR PRADESH,2021,24.0,7.95,8.2,268.5,3.95,,1900.0,3250.0,1651.0,,,
1146,"RIVER GANGA AT BITHOOR (KANPUR), U.P.",River,UTTAR PRADESH,2021,23.75,8.85,8.35,252.0,3.15,,1800.0,3600.0,23.5,,,
1067,"RIVER GANGA AT KANPUR U/S (RANIGHAT), U.P",River,UTTAR PRADESH,2021,24.0,8.45,8.25,256.5,3.5,,2600.0,4750.0,11.0,,,
10154,RIVER GANGA AT BATHING GHAT (BHARAOGHAT),River,UTTAR PRADESH,2021,24.0,8.55,8.3,260.0,3.35,,2150.0,4000.0,40.0,,,
10155,RIVER GANGA AT D/S (SHUKLAGANJ),River,UTTAR PRADESH,2021,21.75,8.4,8.2,272.0,3.6,,2700.0,5250.0,27.0,,,
1068,"RIVER GANGA AT KANPUR D/S (JAJMAU PUMPING STATION), U.P",River,UTTAR PRADESH,2021,21.75,7.7,8.05,297.5,4.25,,13900.0,29000.0,21.0,,,
10157,RIVER GANGA AT BATHING GHAT (JAJMAU BRIDGE),River,UTTAR PRADESH,2021,24.25,7.85,8.2,278.0,4.1,,13250.0,19650.0,26.0,,,
1147,"RIVER GANGA AT DALMAU (RAI BAREILLY), U.P.",River,UTTAR PRADESH,2021,22.0,8.7,8.0,275.5,4.0,0.83,1750.0,3150.0,236.0,,,
2498,"RIVER GANGA AT KALA KANKAR, RAEBARELI",River,UTTAR PRADESH,2021,22.0,9.05,8.0,279.0,3.75,0.81,1750.0,3150.0,231.0,,,
1046,"RIVER GANGA AT ALLAHABAD (RASOOLABAD), U.P.",River,UTTAR PRADESH,2021,24.35,9.25,8.1,286.5,2.65,0.605,1005.0,2350.0,,,,
2487,"RIVER GANGA AT KADAGHAT, ALLAHABAD",River,UTTAR PRADESH,2021,24.3,8.65,7.9,245.0,1.95,0.52,810.0,1480.0,,,,
1049,"RIVER GANGA AT ALLAHABAD D/S (SANGAM), U.P.",River,UTTAR PRADESH,2021,24.45,8.55,8.05,316.0,2.45,0.61,1040.0,2200.0,,,,
10158,"RIVER GANGA A/C TAMSA RIVER, SIRSA, SON BARSA",River,UTTAR PRADESH,2021,24.4,8.5,8.0,319.5,2.5,0.585,865.0,1600.0,,,,
2485,"RIVER GANGA U/S, VINDHYACHAL, MIRZAPUR",River,UTTAR PRADESH,2021,25.0,9.4,7.0,397.0,2.5,0.75,900.0,9150.0,2400.0,,,
2486,"RIVER GANGA D/S, MIRZAPUR",River,UTTAR PRADESH,2021,25.25,8.35,7.6,405.0,2.95,0.75,7400.0,12200.0,5950.0,,,
10153,RIVER GANGA AT CHUNAR,River,UTTAR PRADESH,2021,25.25,9.0,7.95,400.0,2.9,0.75,7500.0,13000.0,5100.0,,,
1070,"RIVER GANGA AT VARANASI U/S (ASSIGHAT), U.P",River,UTTAR PRADESH,2021,24.5,8.4,8.0,405.0,2.25,0.78,900.0,1650.0,2550.0,,,
1071,"RIVER GANGA AT VARANASI D/S (MALVIYA BRIDGE), U.P",River,UTTAR PRADESH,2021,24.5,7.8,7.85,417.0,3.7,0.91,10000.0,18000.0,7950.0,,,
10152,"RIVER GANGA A/C GOMTI RIVER, BHUSAULA",River,UTTAR PRADESH,2021,24.75,7.55,7.95,388.0,3.3,0.875,7500.0,13000.0,3510.0,,,
10156,RIVER GANGA AT BATHING GHAT (GOLA GHAT),River,UTTAR PRADESH,2021,24.0,8.0,8.2,277.5,3.8,,7550.0,14300.0,14.0,,,
1073,"RIVER GANGA AT TRIGHAT (GHAZIPUR), U.P",River,UTTAR PRADESH,2021,25.0,7.4,7.95,416.0,3.9,0.95,11500.0,21500.0,9650.0,,,
30075,RIVER GANGA AT TARIGHAT GHAZIPUR (U.P.),River,UTTAR PRADESH,2021,24.1,7.65,7.55,466.5,3.85,1.575,39510.0,110039.0,,,,
30030,"RIVER YAMUNA AT ASGARPUR VILLAGE,U.P",River,UTTAR PRADESH,2021,28.0,0.3,7.5,1233.0,67.5,2.32,1108500.0,2466500.0,246200.0,,,
2493,RIVER YAMUNA AT SHAHPUR,River,UTTAR PRADESH,2021,29.0,5.7,7.3,,9.4,,48000.0,93000.0,,,,
2495,"RIVER YAMUNA AT KESIGHAT, VRINDAVAN",River,UTTAR PRADESH,2021,26.0,6.0,7.35,,7.9,,33000.0,77500.0,,,,
1123,"RIVER YAMUNA AT MATHURA U/S , U.P.",River,UTTAR PRADESH,2021,24.5,3.55,7.45,1300.0,12.05,2.145,24555.0,47165.0,8534.0,,,
2494,"RIVER YAMUNA AT VISHRAMGHAT, MATHURA",River,UTTAR PRADESH,2021,26.0,5.5,7.35,,9.8,0.3,55000.0,94000.0,,,,
1124,"RIVER YAMUNA AT MATHURA D/S , U.P.",River,UTTAR PRADESH,2021,24.5,5.7,7.7,1417.0,22.3,2.77,460085.0,800245.0,27085.0,,,
1125,"RIVER YAMUNA AT AGRA U/S, U.P.",River,UTTAR PRADESH,2021,29.0,6.85,7.3,1456.0,12.2,1.97,17700.0,81650.0,350120.0,,,
1126,"RIVER YAMUNA AT D/S OF AGRA, U.P.",River,UTTAR PRADESH,2021,29.5,3.9,7.95,1409.5,20.6,1.44,122250.0,250500.0,27650.0,,,
1498,RIVER YAMUNA AT BATESWAR,River,UTTAR PRADESH,2021,22.0,6.75,7.75,1211.5,12.8,,12500.0,23500.0,,,,
10081,RIVER YAMUNA AT ETAWAH D/S,River,UTTAR PRADESH,2021,24.6,5.55,7.45,1141.5,16.6,,22000.0,69000.0,,,,
10082,RIVER YAMUNA AT UDI,River,UTTAR PRADESH,2021,24.45,5.9,7.65,1114.0,14.6,,16500.0,29500.0,,,,
1127,"RIVER YAMUNA AT ETAWAH, U.P.",River,UTTAR PRADESH,2021,27.7,5.6,7.55,1137.0,16.2,,22500.0,72000.0,,,,
1499,"RIVER YAMUNA AT JUHIKA B/C WITH CHAMBAL, ETAWAH, U.P",River,UTTAR PRADESH,2021,25.3,7.25,7.75,948.0,10.0,,12000.0,25500.0,,,,
30034,RIVER YAMUNA AT ETAWAH,River,UTTAR PRADESH,2021,29.5,11.3,8.4,1445.5,19.5,4.96,1010.5,2473.0,22.5,,,
30033,"RIVER YAMUNA A/C OF CHAMBAL AT SHERGARH, JUHIKA (U.P)",River,UTTAR PRADESH,2021,28.5,10.4,8.35,830.5,7.1,2.115,10524.5,35039.5,708.5,,,
2283,RIVER YAMUNA AT HAMIRPUR,River,UTTAR PRADESH,2021,23.5,6.6,7.5,851.0,3.8,,,12000.0,,,,
1069,"RIVER YAMUNA AT ALLAHABAD D/S (BALUA GHAT), U.P",River,UTTAR PRADESH,2021,24.55,7.85,7.8,522.5,2.3,0.59,690.0,1400.0,,,,
10102,RIVER HINDON AT MOHAN NAGAR U/S,River,UTTAR PRADESH,2021,22.5,1.45,7.35,544.5,19.0,0.41,905000.0,1170000.0,,,,
10103,RIVER HINDON AT MOHAN NAGAR D/S,River,UTTAR PRADESH,2021,22.5,0.9,7.5,1231.0,34.5,0.535,1475000.0,1855000.0,,,,
10106,RIVER HINDON AT GHAZIABAD U/S,River,UTTAR PRADESH,2021,22.5,1.7,7.4,546.5,19.0,0.415,195000.0,260000.0,,,,
10100,RIVER HINDON AT BARNAWA U/S,River,UTTAR PRADESH,2021,19.5,0.3,7.5,1070.5,55.0,23.6,110000.0,155000.0,,,,
10101,RIVER HINDON AT BARNAWA D/S,River,UTTAR PRADESH,2021,18.0,0.3,7.5,947.5,54.0,23.6,94500.0,130000.0,,,,
1483,"RIVER HINDON AFTER CONFL. WITH R. KRISHNA & KALI NEAR BINAULI TOWN, PURA MAHADEV, MEERUT, U.P.",River,UTTAR PRADESH,2021,19.0,0.3,7.5,885.0,63.0,25.2,112000.0,150000.0,,,,
2496,"RIVER HINDON AT SARDHANA BUDHANA ROAD, VILLAGE BAPARSI, MEERUT",River,UTTAR PRADESH,2021,18.5,0.3,7.6,1007.0,57.0,23.65,99500.0,130000.0,,,,
1358,"RIVER HINDON AT GHAZIABAD D/S, U.P.",River,UTTAR PRADESH,2021,22.5,0.3,7.55,1095.0,46.5,0.6,6511500.0,10516000.0,,,,
1356,"RIVER BETWA BEFORE CONF. YAMUNA AT HAMIRPUR, U.P.",River,UTTAR PRADESH,2021,21.6,7.65,7.55,676.0,3.15,,,1150.0,,,,
30079,"RIVER BETWA AT SUKMA DUKMA DAM, JHANSI",River,UTTAR PRADESH,2021,25.0,8.25,7.85,286.5,2.5,0.5,2900.0,14150.0,,,,
1064,RIVER RAMGANGA AT KANNAUJ (BEFORE CONF.),River,UTTAR PRADESH,2021,24.5,8.2,8.25,445.0,3.9,,8750.0,18500.0,14.5,,,
30077,"RIVER RAMGANGA AT D/S SHERKOT, KALAGARH (U.P.)",River,UTTAR PRADESH,2021,24.3,7.8,7.6,369.5,1.0,0.425,480000.0,1265000.0,,,,
2497,"RIVER KALI EAST AT KHARKHODA- PARIKSHIT GARH ROAD, VILL. KOL",River,UTTAR PRADESH,2021,18.0,0.3,7.5,995.0,55.0,23.1,120000.0,155000.0,,,,
1477,RIVER KALINADI AT U/S OF MUZAFFAR NAGAR U.P.,River,UTTAR PRADESH,2021,21.25,2.2,7.5,307.5,8.5,,,,,,,
1478,"RIVER KALINADI AT D/S OF MUZAFFAR NAGAR, U.P.",River,UTTAR PRADESH,2021,22.0,0.3,7.15,707.5,28.0,,,,,,,
1480,RIVER KALINADI AT U/S OF GULAOTHI TOWN IN BULANDSAHAR,River,UTTAR PRADESH,2021,26.0,0.3,7.55,500.5,58.0,,1815000.0,2510000.0,,,,
1065,RIVER KALINADI AT KANNAUJ (BEFORE CONF.),River,UTTAR PRADESH,2021,25.0,6.35,8.05,298.0,4.3,,13650.0,23000.0,26.0,,,
30038,RIVER BANGANGA AT D/S SHUKRATAL (BEFORE CONFLUENCE OF LAKSAR DRAIN ),River,UTTAR PRADESH,2021,27.0,5.7,7.35,486.0,3.4,1.27,1210.0,42650.0,251.5,,,
2502,"RIVER BANGANGA SHUKRA TAL, MUZAFFARNAGAR, NEAR GANGA RIVER",River,UTTAR PRADESH,2021,20.0,7.8,7.85,215.0,1.9,,,,,,,
2482,"RIVER VARUNA AT RAMESHWAR, VARANASI",River,UTTAR PRADESH,2021,27.5,8.0,8.0,391.0,2.95,0.775,1250.0,2550.0,,,,
2483,RIVER VARUNA B/C WITH GANGA AT VARANASI,River,UTTAR PRADESH,2021,25.0,4.85,7.5,526.5,9.8,1.27,31500.0,52000.0,,,,
1361,RIVER SAI AT UNNAO AFTER DRAIN OUTFALL,River,UTTAR PRADESH,2021,24.5,6.7,8.15,295.0,2.8,,2900.0,6350.0,,,,
2484,"RIVER SAI AT JALALPUR, JAUNPUR",River,UTTAR PRADESH,2021,25.0,7.7,8.0,388.0,3.5,0.83,6500.0,11500.0,,,,
1350,RIVER GOMTI AT SITAPUR U/S AT WATER INTAKE,River,UTTAR PRADESH,2021,22.25,9.15,8.45,487.0,2.15,1.0,785.0,2100.0,2.0,,,
1351,RIVER GOMTI AT LUCKNOW U/S AT WATER INTAKE POINT,River,UTTAR PRADESH,2021,21.85,8.55,8.25,530.0,3.0,2.95,3700.0,5400.0,2.0,,,
1352,RIVER GOMTI AT LUCKNOW D/S,River,UTTAR PRADESH,2021,22.0,1.0,7.45,702.0,14.6,3.55,149500.0,240000.0,20.0,,,
10097,RIVER GOMTI AT JAUNPUR U/S,River,UTTAR PRADESH,2021,24.75,8.2,8.05,401.0,2.75,0.775,1050.0,2000.0,,,,
1353,RIVER GOMTI AT JAUNPUR D/S,River,UTTAR PRADESH,2021,24.75,7.6,7.95,418.0,3.95,0.84,11000.0,21500.0,,,,
1072,"RIVER GOMTI AT VARANASI, U.P",River,UTTAR PRADESH,2021,24.75,7.75,7.95,411.0,3.55,0.8,7950.0,15200.0,,,,
10083,RIVER GOMTI AT NEEMSAR U/S,River,UTTAR PRADESH,2021,,6.0,8.15,385.0,2.65,,1650.0,3150.0,,,,
10084,RIVER GOMTI AT NEEMSAR D/S,River,UTTAR PRADESH,2021,,5.45,7.95,352.0,2.8,,1750.0,3950.0,,,,
10085,RIVER GOMTI AT BHATPUR U/S,River,UTTAR PRADESH,2021,,5.7,8.1,414.0,2.8,,2500.0,4300.0,,,,
10086,RIVER GOMTI AT BHATPUR D/S,River,UTTAR PRADESH,2021,,5.45,8.1,424.0,2.95,,3300.0,4750.0,2300.0,,,
10087,RIVER GOMTI AT GAUGHAT U/S,River,UTTAR PRADESH,2021,,4.55,7.85,351.0,3.8,,4100.0,6900.0,,,,
10088,RIVER GOMTI AT GAUGHAT D/S,River,UTTAR PRADESH,2021,,4.25,7.85,354.5,4.25,,7050.0,11950.0,,,,
10089,RIVER GOMTI AT MOHMEAK U/S,River,UTTAR PRADESH,2021,,2.5,7.7,453.0,9.5,,74500.0,112000.0,,,,
10090,RIVER GOMTI AT MOHMEAK D/S,River,UTTAR PRADESH,2021,,2.25,7.65,462.0,10.25,,90000.0,140000.0,,,,
10091,RIVER GOMTI AT PIPRAGHAT U/S,River,UTTAR PRADESH,2021,,1.65,7.6,508.0,13.0,,120000.0,205000.0,,,,
10092,RIVER GOMTI AT PIPRAGHAT D/S,River,UTTAR PRADESH,2021,,1.35,7.55,514.0,13.5,,140000.0,250000.0,,,,
10093,RIVER GOMTI AT GANGAGANJ U/S,River,UTTAR PRADESH,2021,,2.95,7.7,402.0,4.5,,10450.0,20500.0,,,,
10094,RIVER GOMTI AT GANGAGANJ D/S,River,UTTAR PRADESH,2021,,3.4,7.75,394.0,4.25,,9000.0,17500.0,,,,
2491,"RIVER RAPTI AT RAJGHAT, GORAKHPUR",River,UTTAR PRADESH,2021,21.5,7.1,7.6,378.0,5.4,,30000.0,49000.0,,,,
1363,"RIVER RAPTI AFTER CONFL. OF R. HONIN NR. DOMINGARH RLY BRIDGE, GORAKHPUR",River,UTTAR PRADESH,2021,17.5,7.6,7.45,299.0,3.75,,17500.0,31000.0,,,,
1355,"RIVER GHAGHARA AT DEORIA D/S, U.P.",River,UTTAR PRADESH,2021,19.5,7.6,7.7,341.0,4.0,,22500.0,32000.0,,,,
2492,"RIVER GHAGHRA AT BARHALGANJ, GORAKHPUR",River,UTTAR PRADESH,2021,21.0,7.45,7.75,425.0,4.9,,31500.0,46000.0,,,,
1359,"RIVER RIHAND AT RENUKUT U/S, U.P.",River,UTTAR PRADESH,2021,23.75,6.2,8.2,304.0,2.3,0.5,450.0,1050.0,,,,
1360,"RIVER RIHAND AT RENUKUT D/S, U.P.",River,UTTAR PRADESH,2021,23.75,8.6,8.25,319.0,2.85,0.6,1750.0,3500.0,,,,
30081,"RIVER SONE U/S TO RIHAND, CHOPAN (U.P.)",River,UTTAR PRADESH,2021,23.1,8.15,7.25,230.0,2.75,0.31,1150.0,4850.0,,,,
30086,"RIVER CHAMBAL AT GWALIOR ROAD BRIDGE, UDI, ETAWAH DIST.",River,UTTAR PRADESH,2021,24.15,8.45,7.9,541.0,1.7,1.6,11850.0,40350.0,-2.0,,,
